178255	2026-02-16T21:19:45	Aydıncık Gezilecek Yerler: Tatil Önerileri, Gezi Planı	https://yoldaolmak.com/aydincik-gezilecek-yerler.html
172299	2026-02-16T17:27:15	Sri Lanka Nasıl Bir Yer? Nerede, Nasıl Gidilir, Gezi Planı	https://yoldaolmak.com/sri-lanka-rehberi.html
173838	2026-02-16T17:24:18	Lizbon Nasıl Bir Yer? Nerede, Nasıl Gidilir, Gezi Planı	https://yoldaolmak.com/lizbon-nerede-lizbona-nasil-gidilir.html
36289	2026-02-16T16:38:06	Mısır Nasıl Bir Yer? Nerede, Nasıl Gidilir, Gezi Planı	https://yoldaolmak.com/misir-nerede-misira-nasil-gidilir.html
161897	2026-02-16T16:33:56	Sevilla Nasıl Bir Yer? Nerede, Nasıl Gidilir, Gezi Planı	https://yoldaolmak.com/sevilla-nerede-sevillaya-nasil-gidilir.html
178250	2026-02-16T15:42:52	Burdur Nasıl Bir Yer? Nerede, Nasıl Gidilir, Gezi Planı	https://yoldaolmak.com/burdur-nerede-nasil-gidilir.html
55226	2026-02-16T13:41:53	Helsinki Nasıl Bir Yer? Nerede, Nasıl Gidilir, Gezi Planı	https://yoldaolmak.com/helsinki-nerede-nasil-gidilir.html
54531	2026-02-16T13:26:23	Çek Cumhuriyeti Nasıl Bir Yer? Nerede, Nasıl Gidilir, Gezi Planı	https://yoldaolmak.com/cek-cumhuriyeti-nerede-cekya-nasil-gidilir.html
162125	2026-02-16T12:57:40	Litvanya Gezi Rehberi: Gezilecek Yerler, Nasıl Gidilir, Gezi Planı	https://yoldaolmak.com/litvanya-gezi-rehberi.html
27336	2026-02-16T12:45:20	Cesky Krumlov Gezi Rehberi: Gezilecek Yerler, Mekanlar	https://yoldaolmak.com/cesky-krumlov-gezi-rehberi.html
56574	2026-02-16T11:46:39	Fethiye Çalış Plajı Rehberi: Deniz, Caretta Caretta, Kuş Cenneti	https://yoldaolmak.com/calis-plaji-fethiye.html
162006	2026-02-16T11:22:49	Toledo Gezi Rehberi: Gezilecek Yerler, Nasıl Gidilir, Gezi Planı	https://yoldaolmak.com/toledo-gezi-rehberi.html
157372	2026-02-16T11:06:54	Milas Gezi Rehberi: Gezilecek Yerler, Nasıl Gidilir, Gezi Planı	https://yoldaolmak.com/milas-gezi-rehberi.html
179511	2026-02-16T10:02:50	Malmö Nasıl Bir Yer? Nerede, Nasıl Gidilir, Gezi Planı	https://yoldaolmak.com/malmo-gezi-rehberi.html
179576	2026-02-16T01:53:07	Simi Nasıl Bir Yer? Nerede, Nasıl Gidilir, Gezi Planı	https://yoldaolmak.com/simi-nerede-simi-nasil-gidilir.html
36895	2026-02-16T00:47:17	Silifke Astım Mağarası: Silifke’nin Doğal Terapi Merkezi	https://yoldaolmak.com/astim-magarasi.html
36857	2026-02-16T00:32:16	Mersin&#8217;in Yaşam Merkezi: Mersin Marina 	https://yoldaolmak.com/mersin-marina.html
154934	2026-02-16T00:22:40	Taşucu Nasıl Bir Yer? Nerede, Nasıl Gidilir, Gezi Planı	https://yoldaolmak.com/tasucu-nerede-tasucuna-nasil-gidilir.html
43113	2026-02-16T00:16:25	Sinasos Mustafapaşa Gezi Rehberi: Gezilecek Yerler	https://yoldaolmak.com/kapadokya-mustafapasa-koyu.html
153	2026-02-15T22:35:50	Fiji&#8217;de Köpekbalıklarıyla Yüzmek!	https://yoldaolmak.com/kopekbaliklariyla-yuzmek.html
37862	2026-02-15T16:49:10	Paros Adası: Gezilecek Yerler, Mekanlar Gezi Rehberi	https://yoldaolmak.com/kiklad-adalarinin-yukselen-yildizi-paros-adasi.html
49175	2026-02-15T16:00:59	Milos Adası Gezi Rehberi	https://yoldaolmak.com/milos-adasi-gezi-rehberi.html
148	2026-02-15T14:58:59	Fiji Time: Bula ve Ada Ritmi	https://yoldaolmak.com/fiji-time-bula.html
144	2026-02-15T14:32:35	Barefoot Kuata Island Resort: Fiji&#8217;de Tropikal Tatil Keyfi	https://yoldaolmak.com/barefoot-kuata-island-resort.html
130	2026-02-15T13:58:53	Kuata Adası: Fiji Yasawa Adaları’na Açılan Kapı	https://yoldaolmak.com/fiji-adalari-kuata-adasi.html
109	2026-02-15T12:52:57	Fiji’nin Hafızası: Viseisei Köyü	https://yoldaolmak.com/viseisei-koyunde-fiji-sabahina-uyanmak.html
131814	2026-02-15T12:13:13	Varda Köprüsü: Adana’nın Tarihi Mühendislik Harikası	https://yoldaolmak.com/varda-koprusu.html
188499	2026-02-15T11:11:41	İbradı Gezi Rehberi: Gezilecek Yerler, Nasıl Gidilir	https://yoldaolmak.com/ibradi-gezi-rehberi.html
192646	2026-02-15T11:09:09	Kovada Gölü Milli Parkı: Eğirdir’in Sessiz ve Saklı Doğası	https://yoldaolmak.com/kovada-golu.html
205781	2026-02-15T10:11:55	Selge Antik Kenti: Torosların Zirvesinde Taşa Yazılmış Hikâye	https://yoldaolmak.com/selge-antik-kenti.html
56477	2026-02-15T09:59:00	Antalya&#8217;nın Doğal Güzeli: Kurşunlu Şelalesi	https://yoldaolmak.com/kursunlu-selalesi-antalya.html
80	2026-02-15T02:36:25	Fiji Viseisei Köyünde Bir Akşam: Kava Çemberinde Oturmak	https://yoldaolmak.com/viseisei-villagede-ilk-gun-kava-seremonisi.html
77	2026-02-15T01:57:28	Dünyanın Diğer Ucu: Fiji Vizesi ve Ülkeye Giriş	https://yoldaolmak.com/fijiye-varis-nadi.html
1000	2026-02-15T01:29:22	Banyuwangi Gezi Rehberi: Java’nın Ucunda Başlayan Macera	https://yoldaolmak.com/banyuwangi-gezilecek-yerler.html
162094	2026-02-15T01:09:28	Bergen Gezilecek Yerler	https://yoldaolmak.com/bergen-gezilecek-yerler.html
41002	2026-02-15T00:49:10	Tromso Gezi Rehberi: Kuzey Işıkları ve Arktik Macera	https://yoldaolmak.com/tromso-gezi-rehberi.html
162087	2026-02-14T23:58:50	Preikestolen: Norveç’in Ünlü Kayalık Platosu	https://yoldaolmak.com/preikestolen-pulpit-rock-norvec.html
52475	2026-02-14T22:49:41	Oslo Nasıl Bir Yer? Nerede, Nasıl Gidilir, Gezi Planı	https://yoldaolmak.com/oslo-nerede-nasil-gidilir.html
57021	2026-02-14T22:18:28	Bergen Nasıl Bir Yer? Nerede, Nasıl Gidilir, Gezi Planı	https://yoldaolmak.com/bergen-nerede-bergen-nasil-gidilir.html
153854	2026-02-14T22:18:26	Londra Nasıl Bir Yer, Nerede, Nasıl Gidilir, Gezi Planı	https://yoldaolmak.com/londra-nerede-nasil-gidilir.html
196081	2026-02-14T21:45:09	İngiltere Nasıl Bir Yer? Nerede, Nasıl Gidilir, Gezi Planı	https://yoldaolmak.com/ingiltere-nerede-nasil-gidilir.html
197324	2026-02-14T20:57:52	Münih Nasıl Bir Yer? Nerede, Nasıl Gidilir, Gezi Planı	https://yoldaolmak.com/munih-nerede-munih-nasil-gidilir.html
166424	2026-02-14T13:23:00	Bir Önderin Hatırası: Ho Chi Minh Mozolesi ve Müzesi	https://yoldaolmak.com/ho-chi-minh-mozolesi-hanoi.html
173634	2026-02-14T12:42:01	Hanoi Gezi Rehberi: Nasıl Bir Yer? Nerede, Nasıl Gidilir, Gezi Planı	https://yoldaolmak.com/hanoi-gezi-rehberi.html
55838	2026-02-14T12:39:17	Hanoi&#8217;nin Kutsal Gölü: Hoan Kiem	https://yoldaolmak.com/hoan-kiem-lake-hanoi.html
47080	2026-02-14T11:43:57	Ejderin Suya İndiği Yer: Halong Bay, Vietnam	https://yoldaolmak.com/halong-bay-vietnam.html
3678	2026-02-14T11:20:10	Vietnam Vizesi Nasıl Alınır	https://yoldaolmak.com/vietnam-vizesi.html
155115	2026-02-14T10:24:19	Danimarka Nasıl Bir Yer? Nerede, Nasıl Gidilir, Gezi Planı	https://yoldaolmak.com/danimarka-nerede-nasil-gidilir.html
162130	2026-02-14T03:49:20	Sibenik Gezi Rehberi: Nasıl Bir Yer? Gezilecek Yerler	https://yoldaolmak.com/sibenik-gezi-rehberi.html
162129	2026-02-14T03:47:24	Pula Gezi Rehberi: Nasıl Bir Yer? Gezilecek Yerler	https://yoldaolmak.com/pula-gezi-rehberi.html
162136	2026-02-14T02:48:16	Rovinj: Hırvatistan’ın En Romantik Köşesi	https://yoldaolmak.com/rovinj-gezi-rehberi.html
162131	2026-02-14T02:19:00	Split Gezi Rehberi: Nasıl Gidilir, Gezi Planı	https://yoldaolmak.com/split-gezi-rehberi.html
179208	2026-02-13T17:41:29	Hırvatistan Gezi Rehberi: Gezilecek Yerler ve Rotalar	https://yoldaolmak.com/hirvatistan-gezi-rehberi.html
55231	2026-02-13T17:18:56	Nice Nasıl Bir Yer? Nerede, Nasıl Gidilir, Gezi Planı	https://yoldaolmak.com/nice-nerede-nice-nasil-gidilir.html
167235	2026-02-13T16:43:23	Madrid Nasıl Bir Yer? Nerede, Nasıl Gidilir, Gezi Planı	https://yoldaolmak.com/madrid-nerede-nasil-gidilir.html
55709	2026-02-13T16:20:29	Kırgızistan Nasıl Bir Yer? Nerede, Nasıl Gidilir, Gezi Planı	https://yoldaolmak.com/kirgizistan-nerede-kirgizistan-nasil-gidilir.html
181149	2026-02-13T12:29:28	Kazablanka Gezi Rehberi: Gezilecek Yerler &amp; Rota Önerileri	https://yoldaolmak.com/kazablanka-gezilecek-yerler.html
157915	2026-02-13T11:41:37	Dubai Nasıl Bir Yer? Nerede, Nasıl Gidilir ve İlk Kez Gidenler İçin İpuçları	https://yoldaolmak.com/dubai-nerede-nasil-gidilir.html
118229	2026-02-13T11:10:00	Rusya Nasıl Bir Yer? Nerede, Nasıl Gidilir, Gezi Planı	https://yoldaolmak.com/rusya.html
202976	2026-02-13T10:12:13	Şafşavan Gezi Rehberi: Nerede, Nasıl Gidilir, Gezi Planı	https://yoldaolmak.com/chefchaouen.html
179637	2026-02-13T09:26:57	Berlin Nasıl Bir Yer? Nerede, Nasıl Gidilir, Gezi Planı	https://yoldaolmak.com/berlin-nerede-berlin-nasil-gidilir.html
161913	2026-02-13T02:12:35	Bratislava Nerede, Nasıl Gidilir ve İlk Kez Gidenler İçin İpuçları	https://yoldaolmak.com/bratislava-nerede-nasil-gidilir.html
167250	2026-02-13T01:41:49	Lviv Nerede, Nasıl Gidilir ve İlk Kez Gidenler İçin İpuçları	https://yoldaolmak.com/lviv-nerede-lvive-nasil-gidilir.html
170340	2026-02-13T01:26:13	Cordoba Nasıl Bir Yer, Nerede, Nasıl Gidilir, Gezi Planı	https://yoldaolmak.com/cordoba-nerede-nasil-gidilir.html
151991	2026-02-13T00:43:50	Ağva Nasıl Bir Yer? Nerede, Nasıl Gidilir, Gezi Planı	https://yoldaolmak.com/agva-nerede-agvaya-nasil-gidilir.html
9813	2026-02-13T00:14:35	Moskova Nasıl Bir Yer? Nerede, Nasıl Gidilir, Gezi Planı	https://yoldaolmak.com/moskova-nerede-moskova-nasil-gidilir.html
52473	2026-02-12T23:51:34	Norveç Nasıl Bir Yer? Nerede, Nasıl Gidilir, Gezi Planı	https://yoldaolmak.com/norvec-nerede-nasil-gidilir.html
154598	2026-02-12T22:29:14	Minsk Nasıl Bir Yer? Nerede, Nasıl Gidilir ve Gezi Planı	https://yoldaolmak.com/minsk-nerede-nasil-gidilir.html
54539	2026-02-12T21:51:52	Frankfurt Nasıl Bir Yer? Nerede, Nasıl Gidilir ve Gezi Planı	https://yoldaolmak.com/frankfurt-nerede-frankfurt-nasil-gidilir.html
53393	2026-02-12T21:32:12	Unutulmaz Helikopter Deneyimi: Cape Town’u Havadan Keşfetmek 🚁	https://yoldaolmak.com/cape-town-helikopter-turu.html
162192	2026-02-12T21:04:47	UNESCO Mirası Table Mountain: Cape Town&#8217;un Efsanevi Doğa Harikası	https://yoldaolmak.com/table-mountain-cape-town.html
155606	2026-02-12T16:30:57	Cape Town Nasıl Bir Yer? Nerede, Nasıl Gidilir ve Gezi Planı	https://yoldaolmak.com/cape-town-nerede-nasil-gidilir.html
56606	2026-02-12T14:56:32	Stockholm Nasıl Bir Yer? Nerede, Nasıl Gidilir ve Gezi Planı	https://yoldaolmak.com/stockholm-nerede-stockholm-nasil-gidilir.html
52982	2026-02-12T12:20:50	Zambezi’nin Kıyısında Sessiz Bir Lüks: Royal Chundu	https://yoldaolmak.com/royal-chundu-zambia.html
53087	2026-02-12T11:51:29	Zambiya&#8217;da Bir Köy Okulu	https://yoldaolmak.com/zambiyada-bir-koy-okulu.html
182721	2026-02-12T11:20:33	Auckland Nasıl Bir Yer? Nerede, Nasıl Gidilir ve Gezi Planı	https://yoldaolmak.com/auckland-nerede-auckland-nasil-gidilir.html
162036	2026-02-12T09:00:01	Granada Nasıl Bir Yer? Nerede, Nasıl Gidilir ve Gezi Planı	https://yoldaolmak.com/granada-nerede-granada-nasil-gidilir.html
161893	2026-02-12T01:19:47	İsveç Nasıl Bir Yer? Nerede, Nasıl Gidilir ve Gezi Planı	https://yoldaolmak.com/isvec-nerede-isvec-nasil-gidilir.html
53633	2026-02-12T01:16:16	Zambiya Gezi Rehberi: Nerede, Nasıl Gidilir ve Gezi Planı	https://yoldaolmak.com/zambiya-gezi-rehberi.html
178274	2026-02-12T00:22:40	Göreme Nasıl Bir Yer? Nerede, Nasıl Gidilir ve Gezi Planı	https://yoldaolmak.com/goreme-nerede-goremeye-nasil-gidilir.html
54543	2026-02-12T00:16:07	Kahire Nasıl Bir Yer? Nerede, Nasıl Gidilir ve Gezi Planı	https://yoldaolmak.com/kahire-nerede-kahire-nasil-gidilir.html
54809	2026-02-11T20:17:32	Katar&#8217;ın Rengârenk Çarşısı: Souq Waqif	https://yoldaolmak.com/souq-waqif-doha.html
152038	2026-02-11T20:12:54	İslam Eserleri Müzesi, Doha, Katar	https://yoldaolmak.com/islam-eserleri-muzesi-doha-katar.html
54759	2026-02-11T20:03:08	Kültürler Vadisi: Katara Kültür Köyü, Doha, Katar	https://yoldaolmak.com/katara-kultur-koyu-doha.html
177918	2026-02-11T19:27:21	Doha Nasıl Bir Yer? Nerede, Nasıl Gidilir ve Gezi Planı	https://yoldaolmak.com/doha-nerede-dohaya-nasil-gidilir.html
41438	2026-02-11T18:51:20	Bari Nasıl Bir Yer? Nerede, Nasıl Gidilir, Gezi Planı	https://yoldaolmak.com/bari-nerede-bari-nasil-gidilir.html
167219	2026-02-11T18:09:14	Prag Nasıl Bir Yer? Nerede, Nasıl Gidilir, Gezi Planı	https://yoldaolmak.com/prag-nerede-praga-nasil-gidilir.html
178303	2026-02-11T12:20:28	Gaziantep Nasıl Bir Yer? Nerede, Nasıl Gidilir, Gezi Planı	https://yoldaolmak.com/gaziantep-nerede-gaziantepe-nasil-gidilir.html
179284	2026-02-11T11:23:43	Katar Nasıl Bir Yer? Nerede, Nasıl Gidilir, Gezi Planı	https://yoldaolmak.com/katar-nerede-katara-nasil-gidilir.html
190166	2026-02-11T00:06:33	Belek Nasıl Bir Yer? Nerede, Nasıl Gidilir, Gezi Planı	https://yoldaolmak.com/belek-rehberi.html
192650	2026-02-10T22:00:01	Erdek Nasıl Bir Yer? Nerede, Nasıl Gidilir, Gezi Planı	https://yoldaolmak.com/erdek-nerede-erdek-nasil-gidilir.html
199223	2026-02-10T19:19:04	Malatya Nasıl Bir Yer? Nerede, Nasıl Gidilir, Gezi Planı	https://yoldaolmak.com/malatya-nerede-malatyaya-nasil-gidilir.html
11287	2026-02-10T18:37:15	Şirince Gezi Rehberi	https://yoldaolmak.com/sirince-koyu.html
148430	2026-02-10T18:22:17	Bozcaada Gezi Rehberi: Gezilecek Yerler, İpuçları ve Öneriler	https://yoldaolmak.com/bozcaada-gezilecek-yerler.html
185972	2026-02-10T17:46:32	Siena Nasıl Bir Yer? Nerede, Nasıl Gidilir, Gezi Planı	https://yoldaolmak.com/siena-nerede-siena-nasil-gidilir.html
157373	2026-02-10T17:13:13	Dalaman Gezi Rehberi: Gezilecek Yerler, Nasıl Gidilir	https://yoldaolmak.com/dalaman-gezilecek-yerler.html
178312	2026-02-10T14:55:13	Tunceli Nasıl Bir Yer? Nerede, Nasıl Gidilir, Gezi Planı	https://yoldaolmak.com/tunceli-nerede-tunceliye-nasil-gidilir.html
177980	2026-02-10T14:34:57	Van Nasıl Bir Yer? Nerede, Nasıl Gidilir, Gezi Planı	https://yoldaolmak.com/van-nerede-vana-nasil-gidilir.html
178288	2026-02-10T14:18:06	Elazığ Nasıl Bir Yer? Nerede, Nasıl Gidilir, Gezi Planı	https://yoldaolmak.com/elazig-nerede-elaziga-nasil-gidilir.html
181308	2026-02-10T14:12:03	Orhaniye Gezilecek Yerler: Nasıl Bir Yer? Nasıl Gidilir, Aktiviteler	https://yoldaolmak.com/orhaniye-gezilecek-yerle.html
173481	2026-02-10T13:56:26	Podgorica Nasıl Bir Yer? Nerede, Nasıl Gidilir, Gezi Planı	https://yoldaolmak.com/podgorica-nerede-podgoricaya-nasil-gidilir.html
57075	2026-02-10T13:36:06	Finlandiya Nasıl Bir Yer? Nerede, Nasıl Gidilir, Gezi Planı	https://yoldaolmak.com/finlandiya-nerede-finlandiya-nasil-gidilir.html
157327	2026-02-10T13:15:28	Midyat Gezi Rehberi: Gezilecek Yerler, Tarihi Mekanlar ve Kültür Rotası	https://yoldaolmak.com/midyat-gezi-rehberi.html
186070	2026-02-10T12:44:45	Gökçeada Gezi Rehberi: Ege’nin Sakin ve Kültür Dolu Adası	https://yoldaolmak.com/gokceada-rehberi.html
157342	2026-02-10T12:32:50	Şile Gezi Rehberi 2026: Şile Gezilecek Yerler ve Plajlar	https://yoldaolmak.com/sile-gezilecek-yerler.html
188800	2026-02-10T11:40:25	Şile Nasıl Bir Yer? Nerede, Nasıl Gidilir, Gezi Planı	https://yoldaolmak.com/sile-nerede-sileye-nasil-gidilir-html.html
186784	2026-02-10T10:56:57	Avustralya Nasıl Bir Yer? Nerede, Nasıl Gidilir, Gezi Planı	https://yoldaolmak.com/avustralya-nerede-avustralyaya-nasil-gidilir.html
155047	2026-02-09T22:01:54	Oylat Şelalesi: Bursa’nın Orman İçinde Sakladığı Serin Kaçış	https://yoldaolmak.com/oylat-selalesi-bursa.html
201893	2026-02-09T21:48:28	Yurtdışında Kredi Kartı Kullanımı: Güvenli Ödeme, Bütçe Kontrolü ve Gezgin İpuçları 💳	https://yoldaolmak.com/yurtdisi-kredi-karti-kullanimi.html
186073	2026-02-09T21:17:56	Adana Yumurtalık Nerede? Yumurtalık’a Nasıl Gidilir ve Yumurtalık Lagünü Rehberi	https://yoldaolmak.com/yumurtalik-nerede-yumurtalik-lagunu-nasil-gidilir.html
36760	2026-02-09T20:01:19	Tatile Çıkmadan Ziyaret Etmeniz Gereken Siteler	https://yoldaolmak.com/tatile-cikmadan-ziyaret-etmeniz-gereken-10-site.html
192652	2026-02-09T18:41:44	Sarıgerme Gezi Rehberi: Gezilecek Yerler, Nasıl Gidilir	https://yoldaolmak.com/sarigerme.html
192647	2026-02-09T17:10:44	Akyaka Gezi Rehberi: Gezilecek Yerler, Ne Yapılır ve Pratik Bilgiler	https://yoldaolmak.com/akyaka-gezilecek-yerler.html
15923	2026-02-09T16:21:30	İsfahan İmam Camii: Yedi Renkli Mozaik Çini Süslemeli	https://yoldaolmak.com/imam-camii-isfahan.html
15910	2026-02-09T15:53:56	Ali Gapu Sarayı: İsfahan’ın Tarihi ve Estetik Kalbi 🏛️	https://yoldaolmak.com/ali-kapu-isfahan.html
15879	2026-02-09T15:42:35	Siosepol Köprüsü: Zayende Nehri Üzerinde Tarih	https://yoldaolmak.com/siosepol-koprusu-isfahan.html
15937	2026-02-09T15:36:42	Mescid-i Cuma Camii: Taşlarda Yaşayan Selçuklu Ruhu	https://yoldaolmak.com/mescid-i-cuma-camii-isfahan.html
15898	2026-02-09T15:30:29	Şeyh Lütfullah Camii: İsfahan’ın Sanat ve Tarih Hazinesi 🕌	https://yoldaolmak.com/seyh-lutfullah-camisi-isfahan-iran.html
15870	2026-02-09T15:15:35	UNESCO Mirası Nakş-ı Cihan: İmam Meydanı	https://yoldaolmak.com/imam-meydani-isfahan.html
173636	2026-02-09T15:10:35	Ho Chi Minh Nasıl Bir Yer? Nerede, Nasıl Gidilir, Gezi Planı	https://yoldaolmak.com/ho-chi-minh-nerede-saygona-nasil-gidilir.html
154019	2026-02-09T13:42:32	İsfahan Nasıl Bir Yer? Nerede, Nasıl Gidilir, Gezi Planı	https://yoldaolmak.com/isfahan-nerede-isfahana-nasil-gidilir.html
9023	2026-02-09T13:12:13	Yurtdışı Telefon Kaydı Nasıl Yapılır	https://yoldaolmak.com/yurtdisi-telefon-kaydi-nasil-yapilir.html
19809	2026-02-09T13:03:11	Ödemiş Gezi Rehberi: Gezilecek Yerler, Nasıl Gidilir	https://yoldaolmak.com/odemis-gezilecek-yerler.html
15930	2026-02-09T12:01:41	Tire Gezilecek Yerler: Ege’nin Saklı Vahasında Keşif	https://yoldaolmak.com/tire-gezilecek-yerler.html
186074	2026-02-09T11:50:47	Samos Adası Nasıl Bir Yer? Nerede, Nasıl Gidilir, Gezi Planı	https://yoldaolmak.com/samos-adasi-nerede-samos-nasil-gidilir.html
211515	2026-02-09T11:45:43	Bakü Nasıl Bir Yer? Nerede, Nasıl Gidilir, Gezi Planı	https://yoldaolmak.com/baku-nerede-bakuye-nasil-gidilir.html
154914	2026-02-09T10:30:46	Manavgat Şelalesi Ziyaret Rehberi: Ulaşım, Giriş Ücreti, Aktiviteler	https://yoldaolmak.com/manavgat-selalesi.html
186067	2026-02-09T09:12:15	Side Nasıl Bir Yer? Nerede, Nasıl Gidilir, Gezi Planı	https://yoldaolmak.com/side-nerede-side-nasil-gidilir.html
11610	2026-02-08T23:43:27	Türkiye Gümrük Sınır Kapıları	https://yoldaolmak.com/gumruk-sinir-kapilari.html
54432	2026-02-08T23:23:33	Sakız Adası Nasıl Bir Yer? Nerede, Nasıl Gidilir, Gezi Planı	https://yoldaolmak.com/sakiz-adasina-nasil-gidilir.html
37799	2026-02-08T22:09:08	Lavanta Tarlaları Gezi Rehberi: Kuyucak Köyü	https://yoldaolmak.com/lavanta-kokulu-bir-yer-kuyucak-isparta.html
13606	2026-02-08T20:09:29	Nemrut Dağı Milli Parkı Rehberi: Nasıl Gidilir, Ne Görülür	https://yoldaolmak.com/nemrut-dagi.html
13576	2026-02-08T19:37:14	Adıyaman Müzesi: Kommagene’den Günümüze Aşağı Fırat’ın Hafızası	https://yoldaolmak.com/adiyaman-muzesi.html
178260	2026-02-08T18:56:22	Adıyaman Nasıl Bir Yer? Nerede, Nasıl Gidilir, Gezi Planı	https://yoldaolmak.com/adiyaman-nerede-adiyamana-nasil-gidilir.html
51901	2026-02-08T18:35:16	Bulak Mencilis Mağarası: Safranbolu’da Gezilecek Doğal Yer	https://yoldaolmak.com/bulak-magarasi-safranbolu.html
32107	2026-02-08T17:55:58	Safranbolu Gezi Rehberi: Zamanın Ruhuna Dokunmak	https://yoldaolmak.com/safranbolu-gezilecek-gorulecek-yerler.html
51903	2026-02-08T17:37:28	Tokatlı Kanyonu ve Kristal Teras: Safranbolu’nun Yeşile Açılan Kapısı	https://yoldaolmak.com/tokatli-kanyonu-ve-cam-teras-safranbolu.html
51836	2026-02-08T17:20:40	Yörük Köyü: Safranbolu&#8217;nun Gizli Cevheri	https://yoldaolmak.com/yoruk-koyu-safranbolu.html
178257	2026-02-08T17:05:59	Nemrut Nasıl Bir Yer? Nerede, Nasıl Gidilir, Gezi Planı	https://yoldaolmak.com/nemrut-nerede-nemrut-nasil-gidilir.html
167963	2026-02-08T16:43:02	Safranbolu Yolculuğu: Nerede, Nasıl Gidilir ve İlk Kez Gideceklere Notlar	https://yoldaolmak.com/safranbolu-nerede-safranboluya-nasil-gidilir.html
157311	2026-02-08T15:56:05	Hatila Vadisi Milli Parkı: Kamp, Yürüyüş ve Keşif Rotaları	https://yoldaolmak.com/hatila-vadisi.html
194305	2026-02-08T15:11:24	Pisa Gezi Rehberi: Nerede, Nasıl Gidilir, Gezi Planı	https://yoldaolmak.com/pisa-italya.html
154946	2026-02-08T14:56:54	Pisa Kulesi: Bir Mühendislik Hatasından Dünya Mirasına	https://yoldaolmak.com/pisa-kulesi.html
197318	2026-02-08T13:57:39	Marakeş Nasıl Bir Yer? Nerede, Nasıl Gidilir, Gezi Planı	https://yoldaolmak.com/marakes-nerede-marakes-nasil-gidilir.html
203013	2026-02-08T11:52:24	Vietnam Nasıl Bir Yer? Nerede, Nasıl Gidilir, Gezi Planı	https://yoldaolmak.com/vietnam-nasil-gidilir.html
19616	2026-02-08T10:19:09	Dikili’de Gezilecek Yerler: Ege’nin Sakin Tatil Rotası	https://yoldaolmak.com/dikili-gezilecek-yerler.html
161874	2026-02-07T21:14:15	Hollanda Nasıl Bir Yer? Nerede, Nasıl Gidilir, Gezi Planı 🇳🇱	https://yoldaolmak.com/hollanda-nerede-hollandaya-nasil-gidilir.html
188459	2026-02-07T20:54:16	Santorini Adası Nasıl Bir Yer? Nerede, Nasıl Gidilir, Gezi Planı	https://yoldaolmak.com/santorini-adasi-nerede-santorini-nasil-gidilir.html
148432	2026-02-07T19:58:23	Gölyazı Nasıl Bir Yer? Nerede, Nasıl Gidilir, Gezi Planı	https://yoldaolmak.com/golyazi-nerede-golyazi-nasil-gidilir.html
118231	2026-02-07T19:20:02	Macaristan Nasıl Bir Yer? Nerede, Nasıl Gidilir, Gezi Planı 🇭🇺	https://yoldaolmak.com/macaristan-nerede-macaristan-nasil-gidilir.html
167265	2026-02-07T18:19:34	Paris Nasıl Bir Yer? Nerede, Nasıl Gidilir, Gezi Planı	https://yoldaolmak.com/paris-nerede-parise-nasil-gidilir.html
184186	2026-02-07T17:42:30	Bangkok Nasıl Bir Yer? Nerede, Nasıl Gidilir, Gezi Planı	https://yoldaolmak.com/bangkok-nerede-bangkok-nasil-gidilir.html
36064	2026-02-07T11:51:22	Belgrad Nasıl Bir Yer? Nerede, Nasıl Gidilir, Gezi Planı	https://yoldaolmak.com/belgrada-nasil-gidilir.html
181099	2026-02-07T11:35:58	Fas Nasıl Bir Yer: Nerede, Nasıl Gidilir, Gezi Planı	https://yoldaolmak.com/fas-nerede-fas-nasil-gidilir.html
165258	2026-02-07T10:51:41	Kos Adası Nasıl Bir Yer: Nerede, Nasıl Gidilir, Gezi Planı	https://yoldaolmak.com/kos-adasi-nerede-kosa-nasil-gidilir.html
170329	2026-02-07T09:48:59	Venedik Nasıl Bir Yer: Nerede, Nasıl Gidilir, Gezi Planı 🇮🇹	https://yoldaolmak.com/venedik-nerede-venedik-nasil-gidilir.html
170388	2026-02-06T23:06:03	Saraybosna Nasıl Bir Yer? Nerede? Nasıl Gidilir	https://yoldaolmak.com/saraybosna-nerede-nasil-gidilir.html
22076	2026-02-06T22:49:24	Wadi Rum Gezi Rehberi: Bedevi Kampları, Kanyonlar ve Çöl Macerası	https://yoldaolmak.com/wadi-rum-gezi-rehberi.html
22115	2026-02-06T21:38:16	The Seven Pillars of Wisdom: Bilgeliğin Yedi Sütunu	https://yoldaolmak.com/the-seven-pillars-of-wisdom-bilgeligin-yedi-sutunu.html
22181	2026-02-06T21:25:30	Bir Çölün Düşündürdükleri: Ay Vadisi, Ürdün	https://yoldaolmak.com/bir-colun-dusundurdukleri-wadi-rum.html
34681	2026-02-06T20:59:15	Akabe&#8217;de Dalış: Kızıldeniz’de Mercan Resifleri	https://yoldaolmak.com/akabe-dalis-kizildeniz.html
34720	2026-02-06T20:20:51	Aqaba Marine Reserve &amp; Aquarium, Ürdün 🐠🌊	https://yoldaolmak.com/aqaba-marine-reserve.html
19127	2026-02-06T19:32:11	Guest Dergi Romantik Şehir Heidelberg	https://yoldaolmak.com/heidelberg-almanya-romantik-sehir-heidelberg.html
34686	2026-02-06T18:06:56	Nebatiler Kimdir? Petra Antik Kenti’nin Gizemli Sahipleri	https://yoldaolmak.com/siradisi-halk-nebatiler.html
23653	2026-02-06T17:32:14	Kayalara Oyulmuş Tapınak: El-Deir Manastırı, Petra	https://yoldaolmak.com/el-deir-manastiri-petra.html
22230	2026-02-06T16:20:53	The Siq: Dünyanın En Güzel Antik Yollarından Biri	https://yoldaolmak.com/the-siq-petra-urdun.html
23092	2026-02-06T15:56:17	Mum Işığında Bir Yüz: El-Hazne ve Petra by Night	https://yoldaolmak.com/petra-by-night.html
22123	2026-02-06T15:39:00	Petra’nın Bilinen Yüzü: El-Hazne	https://yoldaolmak.com/petranin-bilinen-yuzu-el-hazne.html
23467	2026-02-06T15:21:03	Petra Antik Kenti: Nebatilerin Kayıp Başkenti	https://yoldaolmak.com/nebatilerin-kayip-kenti-petra-urdun.html
23703	2026-02-06T12:39:28	Petra Nasıl Bir Yer? Petra Nerede, Nasıl Gidilir, Gezi Planı	https://yoldaolmak.com/petra-nerede-petraya-nasil-gidilir.html
182653	2026-02-05T16:14:06	Bremen Gezi Rehberi: Gezilecek Yerler, Ulaşım ve Konaklama	https://yoldaolmak.com/bremen-gezi-rehberi.html
31556	2026-02-05T11:40:29	Malta Nasıl Bir Yer? Nerede, Nasıl Gidilir, Gezi Planı 🇲🇹	https://yoldaolmak.com/malta-nasil-bir-yer-nerede-nasil-gidilir.html
55844	2026-02-04T22:47:37	Malta Gezi Rehberi: Gezilecek Yerler, Yerel Deneyimler	https://yoldaolmak.com/malta.html
168373	2026-02-04T19:08:58	Roma Nasıl Bir Yer: Nerede, Nasıl Gidilir, Gezi Planı 🇮🇹	https://yoldaolmak.com/roma-nerede-romaya-nasil-gidilir.html
169998	2026-02-04T16:20:18	İtalya Nasıl Bir Yer: Nerede, Nasıl Gidilir, Gezi Planı 🇮🇹 	https://yoldaolmak.com/italya-nerede-italyaya-nasil-gidilir.html
178242	2026-02-04T14:49:16	Porto Nasıl Bir Yer: Nerede, Nasıl Gidilir, Gezi Planı 🇵🇹	https://yoldaolmak.com/porto-nerede-nasil-gidilir.html
57019	2026-02-04T12:02:41	Kopenhag Nasıl Bir Yer: Nerede, Nasıl Gidilir, Gezi Planı	https://yoldaolmak.com/kopenhag-nerede-kopenhaga-nasil-gidilir.html
18048	2026-02-03T14:16:34	Batum Gezi Rehberi: Dağ ile Denizin Kucaklaştığı Şehir	https://yoldaolmak.com/batum-gezi-rehberi.html
50842	2026-02-03T12:24:44	Yeryüzünde Benzersiz Bir Coğrafya: Pamukkale	https://yoldaolmak.com/pamukkale-travertenleri.html
38163	2026-02-03T10:18:16	Selanik Gezi Rehberi 2026 | Selanik’te Gezilecek Yerler, Ne Yenir, Nerede Kalınır	https://yoldaolmak.com/selanik-gezilecek-yerler.html
34677	2026-02-03T09:31:07	Selanik&#8217;in Kalbindeki Lezzet Şöleni: Agora Modiano	https://yoldaolmak.com/selanik-agora-modiano.html
148947	2026-02-03T01:58:06	Portekiz Gezi Rehberi: Yavaşlayan Zamanın Ülkesi	https://yoldaolmak.com/portekiz-gezi-rehberi.html
161931	2026-02-03T01:06:56	Kuala Lumpur&#8217;a Nasıl Gidilir, Ulaşım ve Uçuş Rehberi	https://yoldaolmak.com/kuala-lumpur-nasil-gidilir.html
