179555	2023-05-25T08:36:00	Ankara&#8217;nın Tarihi Kalbi: Ankara Kalesi	https://yoldaolmak.com/ankara-kalesi-gezilecek-yerler.html
48386	2023-05-23T08:23:00	Adelaide Gezi Rehberi	https://yoldaolmak.com/adelaide-gezi-rehberi.html
148843	2023-05-23T08:14:00	Zamanın Durduğu Şehir: Beypazarı Gezi Rehberi	https://yoldaolmak.com/beypazari-gezilecek-yerler.html
16611	2023-05-20T08:11:00	İzmir Gezilecek Tarihi Yerler	https://yoldaolmak.com/izmir-tarihi-yerler.html
43900	2023-05-09T08:16:00	Arnavutluk&#8217;un En Güzel Yerlerinden: Kruja	https://yoldaolmak.com/arnavutlukun-en-guzel-yerlerinden-kruja.html
153865	2023-05-03T08:12:00	Floransa Gezi Rehberi	https://yoldaolmak.com/floransa-gezilecek-yerler.html
10879	2023-04-27T08:18:00	Ankara&#8217;da Gezilecek Tarihi Yerler	https://yoldaolmak.com/ankara-tarihi-yerler.html
13895	2023-04-23T08:17:00	Ankara Rahmi M. Koç Müzesi	https://yoldaolmak.com/ankara-rahmi-koc-muzesi.html
2009	2023-04-08T20:27:58	Jungle ve Yağmur Ormanları Arasındaki Fark Nedir?	https://yoldaolmak.com/jungle-ve-yagmur-ormanlari-arasindaki-fark-nedir.html
46690	2023-04-02T08:23:42	Uçhisar Gezi Rehberi	https://yoldaolmak.com/uchisar-gezilecek-yerler.html
36890	2023-03-19T08:11:00	Tarsus Yedi Uyurlar Mağarası: Eshab-ı Kehf	https://yoldaolmak.com/eshab-i-kehf-tarsus.html
36883	2023-03-19T08:11:00	Tamamı Kesme Taştan Yapılmış Tarsus Ulucamii	https://yoldaolmak.com/ulucamii-tarsus.html
52804	2023-03-11T09:00:00	Batumi Boulevard: Batum Bulvarı	https://yoldaolmak.com/batum-bulvari.html
151907	2023-02-25T08:15:00	Isparta-Burdur Gezilecek Yerler	https://yoldaolmak.com/isparta-burdur-gezilecek-yerler.html
21775	2023-02-13T09:00:19	Kemerli Kilise, Tirilye	https://yoldaolmak.com/kemerli-kilise-trilye.html
205770	2023-01-31T08:11:00	Damlataş Mağarası	https://yoldaolmak.com/damlatas-magarasi.html
147005	2023-01-30T08:22:00	Alanya Kalesi ve Kızılkule	https://yoldaolmak.com/alanya-kalesi.html
220297	2023-01-20T08:20:00	Phi Phi Leh Adası: Maya Bay, Tayland	https://yoldaolmak.com/phi-phi-leh-adasi-maya-bay-tayland.html
179810	2023-01-07T08:15:00	Çam Balı İle Ünlü Bayır Köyü, Marmaris	https://yoldaolmak.com/bayir-koyu-marmaris.html
56202	2023-01-05T08:23:00	Olimpos Gezi Rehberi	https://yoldaolmak.com/olimpos-gezilecek-yerler.html
162201	2023-01-03T08:20:00	Şiir Şehri Struga Gezi Rehberi	https://yoldaolmak.com/struga-gezi-rehberi.html
57039	2023-01-03T08:16:00	Likya Uygarlığının Önemli Kentlerinden Pınara Antik Kenti	https://yoldaolmak.com/pinara-antik-kenti.html
44356	2022-12-14T08:13:00	Belgrad&#8217;ın Karşı Yakası: Zemun	https://yoldaolmak.com/zemun-belgrad.html
57037	2022-12-13T08:21:00	Kanatlı At Pegasus&#8217;un Yaşadığı Yer: Tlos Antik Kenti	https://yoldaolmak.com/tlos-antik-kenti.html
225412	2022-12-12T08:26:00	Bontoc Gezi Rehberi	https://yoldaolmak.com/bontoc-gezi-rehberi.html
2535	2022-12-10T08:22:00	Taytay Kasabası, Palawan	https://yoldaolmak.com/taytay-palawan-adasi.html
20713	2022-12-09T08:02:00	Karadağ&#8217;daki Arnavutluk: Ulcinj (Ülgün)	https://yoldaolmak.com/ulcinj-karadag.html
173334	2022-12-07T08:25:00	Bosna&#8217;da 550 Yıllık Derviş Mekanı: Blagay Tekkesi	https://yoldaolmak.com/blagay-tekkesi.html
229319	2022-12-04T08:20:00	Matka Kanyonu, Makedonya	https://yoldaolmak.com/matka-kanyonu-makedonya.html
205776	2022-12-03T08:11:00	Sapadere Kanyonu, Alanya	https://yoldaolmak.com/sapadere-kanyonu.html
167308	2022-12-01T08:00:00	Makedonya&#8217;nın En Güzel Kilisesi: Kaneo Saint John	https://yoldaolmak.com/kaneo-saint-john-ohrid.html
167310	2022-11-30T08:11:00	Prespa Gölü: Galicica Milli Parkı, Makedonya	https://yoldaolmak.com/prespa-golu-galicica-milli-parki.html
229328	2022-11-30T08:08:00	Stobi Antik Kenti, Makedonya	https://yoldaolmak.com/stobi-antik-kenti.html
53549	2022-11-29T08:46:00	Tiran Gezi Rehberi	https://yoldaolmak.com/tiran-nerede-tirana-nasil-gidilir.html
43514	2022-11-26T08:19:00	Üsküp Eski Çarşı, Makedonya	https://yoldaolmak.com/uskup-eski-carsi-makedonya.html
10000	2022-11-24T08:06:00	Budapeşte&#8217;nin En Büyük Kaplıcası: Szechenyi Termal	https://yoldaolmak.com/szechenyi-kaplicalari-budapeste.html
39361	2022-11-23T08:21:00	Budapeşte Büyük Market: Central Market Hall	https://yoldaolmak.com/budapeste-central-market-hall.html
39374	2022-11-23T08:11:00	Budapeşte’nin En Meşhur İkonu: Zincir Köprü	https://yoldaolmak.com/zincir-kopru-budapeste.html
154382	2022-11-22T08:02:00	En İyi Budapeşte Kaplıcası: Gellert Kaplıcaları	https://yoldaolmak.com/hotel-gellert-thermal-bath.html
44681	2022-11-21T08:13:00	Sırbistan&#8217;ın En Büyük Tapınağı: Aziz Sava Kilisesi	https://yoldaolmak.com/aziz-sava-kilisesi-belgrad.html
147727	2022-11-20T08:37:00	Budin Kalesinin Gözde Yapısı: Matthias Kilisesi, Budapeşte	https://yoldaolmak.com/matthias-kilisesi-budapeste.html
20520	2022-11-20T08:13:00	Üsküp Gece Hayatı	https://yoldaolmak.com/uskup-gece-hayati.html
27308	2022-11-18T08:02:00	Macaristan Parlamento Binası, Budapeşte	https://yoldaolmak.com/budapeste-parlamento-binasi.html
228389	2022-11-17T17:19:45	Budapeşte Yakınlarında Gezilecek Yerler	https://yoldaolmak.com/budapeste-yakinlarinda-gezilecek-yerler.html
36160	2022-11-13T08:29:00	Amalfi Kıyıları Gezi Rehberi	https://yoldaolmak.com/amalfi-gezi-rehberi.html
30627	2022-11-13T08:17:00	Vico Equense, İtalya	https://yoldaolmak.com/vico-equense-italya.html
39365	2022-11-09T08:12:00	Dünyanın En İyi Cafelerinden Birisi: New York Cafe, Budapeşte	https://yoldaolmak.com/new-york-cafe-budapeste.html
9949	2022-11-08T08:14:00	Özgürlük Meydanı: Szabadság tér, Budapeşte	https://yoldaolmak.com/ozgurluk-meydani-szabadseg-ter-budapeste.html
36309	2022-11-08T08:12:00	Akdeniz’in En Lanetli Adası: Gaiola Adası, Napoli	https://yoldaolmak.com/gaiola-adasi-napoli.html
218362	2022-11-07T08:08:00	Endonezya Turu Planlama	https://yoldaolmak.com/endonezya-turu.html
755	2022-11-06T08:23:00	Kutsal Maymun Ormanı: Ubud Monkey Forest	https://yoldaolmak.com/ubud-monkey-forest.html
46686	2022-11-06T08:12:00	Duvar Resimleriyle Ünlü Hacı Ethem Bey Camii, Tiran	https://yoldaolmak.com/haci-ethem-bey-camii-tiran.html
2523	2022-11-06T08:11:00	Filipinler Turu Planlama	https://yoldaolmak.com/filipinler-turu.html
767	2022-11-05T08:35:00	El Sanatları Köyü: Mas Village, Ubud	https://yoldaolmak.com/el-sanatlari-koyu-mas-village.html
26487	2022-11-05T08:14:00	Manastır Askeri İdadisi, Makedonya	https://yoldaolmak.com/manastir-askeri-idadisi-bitola-makedonya.html
52367	2022-11-05T08:11:00	Bohol Adası Gezi Rehberi	https://yoldaolmak.com/bohol-adasi.html
10019	2022-11-05T08:02:00	Budapeşte Aziz Stefan Bazilikası: Szent István Bazilika	https://yoldaolmak.com/st-stephen-bazilikasi-budapeste.html
186056	2022-11-05T08:01:00	Budapeşte’nin En Güzel Manzarası: Gellert Tepesi	https://yoldaolmak.com/gellert-tepesi.html
10021	2022-11-04T08:24:00	Balıkçı Tabyası: Fisherman&#8217;s Bastion	https://yoldaolmak.com/balikci-tabyasi.html
1858	2022-11-04T08:22:00	Dünya Harikalarından: Danum Vadisi, Borneo	https://yoldaolmak.com/danum-vadisi-borneo.html
181469	2022-11-03T08:09:00	Budapeşte Şehir Parkı: Varosliget	https://yoldaolmak.com/budapeste-sehir-parki-varosliget.html
46683	2022-11-02T08:21:00	Arnavutluk&#8217;ta Bir Bektaşi Türbesi: Sarı Saltuk Türbesi, Kruja	https://yoldaolmak.com/sari-saltuk-turbesi-kruja.html
2656	2022-11-02T08:19:00	Dünyanın Yeni 7 Harikası: Puerto Princesa Yeraltı Nehri	https://yoldaolmak.com/puerto-princesa-yeralti-nehri.html
189204	2022-11-02T08:15:00	Batthyany Meydanı: Lajos Batthyány, Budapeşte	https://yoldaolmak.com/batthyany-meydani-vizivaros-budapeste.html
151297	2022-11-01T08:32:00	Budapeşte Termal Kaplıcaları Rehberi	https://yoldaolmak.com/budapeste-kaplicalari-rehberi.html
179545	2022-10-30T08:22:00	Yahudi Cemaatinin İbadethanesi: Dohány Sinagogu, Budapeşte	https://yoldaolmak.com/dohany-sinagogu-budapeste.html
2279	2022-10-30T08:21:00	Sisler İçerisinde Bir Kent: Baguio	https://yoldaolmak.com/baguio-gezi-rehberi.html
2240	2022-10-30T08:11:00	Maceraperestlerin Durağı: Sagada	https://yoldaolmak.com/sagada-gezi-rehberi.html
2129	2022-10-29T08:24:00	Manila Gezi Rehberi	https://yoldaolmak.com/manila-gezi-rehberi.html
2155	2022-10-29T08:23:00	UNESCO Kültür Mirası: Batad Pirinç Tarlaları	https://yoldaolmak.com/batad-pirinc-tarlalari.html
2178	2022-10-29T08:13:00	Tappiyah Şelalesi Trekking, Batad	https://yoldaolmak.com/tappiya-selalesi-batad.html
2139	2022-10-28T08:27:00	UNESCO Dünya Mirası: Banaue Pirinç Tarlaları	https://yoldaolmak.com/banaue-pirinc-tarlalari.html
167624	2022-10-27T08:39:00	Sofya Gezi Rehberi	https://yoldaolmak.com/sofya-gezi-rehberi.html
4706	2022-10-27T08:25:00	Kutsal Bir Heykel Parkı: Buddha Park, Laos	https://yoldaolmak.com/buddha-park-laos.html
4355	2022-10-27T08:09:00	Phonsavan Gezi Rehberi	https://yoldaolmak.com/phonsavan-gezi-rehberi.html
4007	2022-10-26T08:23:00	Geçmişe Yolculuk: Luang Nam Ha National Park	https://yoldaolmak.com/luang-nam-ha-national-park.html
3989	2022-10-26T08:11:00	Into the Wild: Luang Nam Tha	https://yoldaolmak.com/luang-namtha-gezi-rehberi.html
4080	2022-10-25T08:16:00	Muhteşem Dağlar Arasında: Nong Khiaw	https://yoldaolmak.com/nong-khiaw.html
3946	2022-10-25T08:03:00	Mekong Nehrinde Yolculuk: Pakbeng Köyü	https://yoldaolmak.com/pakbeng-gezi-rehberi.html
4661	2022-10-24T08:21:00	İnsan Ticareti Endüstrisinin Kaynağı: Golden Triangle	https://yoldaolmak.com/altin-ucgen-golden-triangle.html
3922	2022-10-24T08:20:00	Luang Prabang Gezi Rehberi	https://yoldaolmak.com/luang-prabang-gezi-rehberi.html
224078	2022-10-23T23:27:42	Laos Vizesi Nasıl Alınır	https://yoldaolmak.com/laos-vizesi-nasil-alinir.html
44258	2022-10-23T08:16:00	Belgrad Kalesi: Kalemegdan	https://yoldaolmak.com/kalemegdan.html
9658	2022-10-23T08:08:00	Bambu Adası: Koh Russei	https://yoldaolmak.com/bambu-adasi-koh-russei.html
9043	2022-10-22T08:21:00	Güneydoğu Asya&#8217;da Bozulmamış Bir Ekosistem: Cardamom Mountains	https://yoldaolmak.com/cardamom-mountains.html
10027	2022-10-22T08:14:00	Görkemli Budin Kalesi: Buda Kraliyet Sarayı	https://yoldaolmak.com/buda-kalesi-budapeste.html
10567	2022-10-22T08:06:00	Fransız Kolonyal Kasabası: Kampot	https://yoldaolmak.com/kampot-kambocya.html
9985	2022-10-21T08:27:00	Prenses Margit&#8217;in Hapishanesi: Margaret Adası, Budapeşte	https://yoldaolmak.com/margaret-adasi.html
10947	2022-10-21T08:21:00	Dünya Biyosfer Rezerv Alanı: Tonle Sap Gölü	https://yoldaolmak.com/tonle-sap-golu.html
205774	2022-10-20T08:11:00	Dim Çayı Milli Parkı ve Dim Mağarası	https://yoldaolmak.com/dim-cayi-milli-parki-dim-magarasi.html
10588	2022-10-17T08:45:00	Huzurlu Bir Sahil Kasabası: Kep	https://yoldaolmak.com/kep-kambocya.html
31592	2022-10-17T08:21:00	Toprağa Gömülen Kent: Herculaneum Antik Kenti	https://yoldaolmak.com/topraga-gomulen-kent-herculaneum.html
9717	2022-10-16T08:22:00	Beyaz Kumlu Sahiller: Sihanoukville, Kamboçya	https://yoldaolmak.com/sihanoukville-kambocya.html
50378	2022-10-16T08:08:00	Budapeşte&#8217;nin Kalbi: Vörösmarty Meydanı	https://yoldaolmak.com/vorosmarty-meydani-budapeste.html
10092	2022-10-15T08:38:00	Güney Asya&#8217;da Popüler Bir Lokma: Balut	https://yoldaolmak.com/balut-yemegi.html
3684	2022-10-15T08:09:00	Kamboçya Vizesi Nasıl Alınır	https://yoldaolmak.com/kambocya-vizesi.html
42875	2022-10-14T09:00:00	Erotik Pompeii Şehri	https://yoldaolmak.com/erotizm-pompeii.html
9006	2022-10-14T08:01:00	Koh Kong Gezi Rehberi, Kamboçya	https://yoldaolmak.com/koh-kong-kambocya.html
147728	2022-10-12T08:22:00	Rudas Fürdő Kaplıcası, Budapeşte	https://yoldaolmak.com/rudas-kaplicasi.html
10025	2022-10-12T08:03:00	UNESCO Kültür Mirası: Andrassy Bulvarı, Budapeşte	https://yoldaolmak.com/andrassy-bulvari-budapeste.html
11723	2022-10-10T08:47:00	Kamboçya Turu Planlama	https://yoldaolmak.com/kambocya-turu.html
34678	2022-10-10T08:14:00	Üsküp&#8217;ün Süslü Köprüleri, Makedonya	https://yoldaolmak.com/uskup-kopruleri-makedonya.html
11790	2022-10-09T08:23:00	Her Mevsim Tatil: Ko Samet Adası, Tayland	https://yoldaolmak.com/ko-samet-adasi.html
11766	2022-10-09T08:23:00	Apsara: Geleneksel Khmer Dansı	https://yoldaolmak.com/apsara-geleneksel-khmer-dansi.html
2317	2022-10-08T08:11:00	2000 Yıllık Gizemli Gelenek: Asılı Tabutlar	https://yoldaolmak.com/asili-tabutlar-hanging-coffins.html
3712	2022-10-07T08:02:00	Gezginlerin Bangkok&#8217;taki Buluşma Yeri: Khao San Road	https://yoldaolmak.com/khao-san-road-bangkok.html
3430	2022-10-05T08:23:00	Ao Phang Nga National Park: James Bond Adası	https://yoldaolmak.com/ao-phang-nga-national-park.html
3341	2022-10-03T08:24:00	Khao Phra Thaeo Wildlife Sanctuary, Phuket	https://yoldaolmak.com/khao-phra-thaeo-wildlife-sanctuary.html
191970	2022-10-03T08:20:00	Macar Devlet Opera Binası, Budapeşte	https://yoldaolmak.com/macar-devlet-operasi.html
186055	2022-10-02T08:01:00	Budapeşte Gece Hayatı	https://yoldaolmak.com/budapeste-gece-hayati.html
19658	2022-10-01T08:43:00	Altın Buddha Tapınağı: Wat Traimit, Bangkok	https://yoldaolmak.com/wat-traimit-altin-budha-tapinagi-bangkok.html
36148	2022-10-01T08:14:00	Cehennem Bacası: Vezüv Yanardağı	https://yoldaolmak.com/vezuv-yanardagi.html
7783	2022-09-20T08:11:00	Sumaguing Mağarası: Hayatınızda Yaptığınız En Büyük Çılgınlık Nedir?	https://yoldaolmak.com/sumaguing-magarasi-sagada.html
43890	2022-09-17T08:15:00	Belgrad&#8217;ın Kalbi: Knez Mihailova Caddesi	https://yoldaolmak.com/kneza-mihaila-caddesi-belgrad.html
1232	2022-09-15T08:12:00	Orangutanlarla Yürümek: Gunung Leuser National Park	https://yoldaolmak.com/gunung-leuser-national-park.html
7786	2022-09-14T08:22:00	Stupa Nedir	https://yoldaolmak.com/stupa-nedir.html
968	2022-09-09T11:55:00	Geleneksel Bali Dans Gösterisi: Keçak Dansı, Uluwatu	https://yoldaolmak.com/uluwatu-temple-kecak-dansi.html
91298	2022-09-09T08:16:00	Dünyanın En Yüksek Dönme Dolabı: Singapore Flyer	https://yoldaolmak.com/singapore-flyer.html
154140	2022-09-08T08:13:00	Afrika Sanatı Müzesi, Belgrad	https://yoldaolmak.com/afrika-sanati-muzesi-belgrad.html
16760	2022-09-06T08:59:00	Bir Başka Havalimanı: Singapore Jewel Changi Airport	https://yoldaolmak.com/singapur-changi-havalimani-farkli-bir-deneyim.html
732	2022-09-06T08:32:00	Galungan Festivali: Kuningan Günü, Bali	https://yoldaolmak.com/galungan-festivali-bali.html
16758	2022-09-04T08:18:00	El Nido Tour D: Cadlao Adası ve Paradise Beach	https://yoldaolmak.com/el-nido-tour-d.html
36174	2022-09-04T08:14:00	Napoli&#8217;nin En Renkli Sokağı: Via San Gregorio Armeno	https://yoldaolmak.com/via-san-gregorio-armeno-napoli.html
2559	2022-09-03T08:31:00	El Nido Tour C: Hidden Beach ve Matinloc Adası	https://yoldaolmak.com/el-nido-tour-c.html
36178	2022-09-03T08:12:00	Napoli Tarihi Şehir: Centro Storico	https://yoldaolmak.com/centro-storico-napoli.html
938	2022-09-03T08:11:00	Endonezya Vizesi	https://yoldaolmak.com/endonezya-vizesi.html
2614	2022-09-02T08:11:00	El Nido Tour B: Snake ve Pinagbuyutan Adaları	https://yoldaolmak.com/el-nido-tour-b.html
36168	2022-09-02T08:07:00	Chiostro di Santa Chiara: Santa Chiara Manastırı	https://yoldaolmak.com/santa-chiara-manastiri.html
2586	2022-09-01T08:00:00	El Nido Tour A: Small, Big ve Secret Lagoon	https://yoldaolmak.com/el-nido-tour-a.html
49761	2022-08-30T08:14:00	Napoli Yakınlarında Görülmesi Gereken 10 Yer	https://yoldaolmak.com/napoli-civarinda-gorulecek-yerler.html
208513	2022-08-30T08:12:00	Akseki Etnografya Müzesi	https://yoldaolmak.com/akseki-etnografya-muzesi.html
162132	2022-08-30T08:06:00	Zadar Gezilecek Yerler	https://yoldaolmak.com/zadar-gezilecek-yerler.html
52576	2022-08-28T08:13:00	MacRitchie Reservoir ve Top Tree Walk, Singapur	https://yoldaolmak.com/macritchie-reservoir-top-tree-walk-singapur.html
1085	2022-08-27T08:35:00	En Güzel Pattaya Plajları	https://yoldaolmak.com/pattaya-plajlari.html
34719	2022-08-25T08:15:00	Görkemli Phuket Big Buddha: Wat Chalong	https://yoldaolmak.com/phuket-big-buddha.html
195769	2022-08-25T08:11:00	Doi Inthanon National Park, Chiang Mai	https://yoldaolmak.com/doi-inthanon-national-park-chiang-mai.html
42926	2022-08-25T08:03:00	Singapur&#8217;un Müslüman Yüzü: Kampong Glam ve Bugis	https://yoldaolmak.com/bugis-ve-kampong-glam-singapur.html
147031	2022-08-23T08:49:00	Kaş Kıbrıs Deresi Kanyonu	https://yoldaolmak.com/kibris-kanyonu-kas.html
153834	2022-08-11T21:20:31	Singapur Hakkında Bilgiler	https://yoldaolmak.com/singapur-hakkinda-bilgiler.html
195771	2022-08-11T08:34:00	Chiang Mai&#8217;nin Kuzey Yıldızı: Doi Suthep Tapınağı	https://yoldaolmak.com/chiang-mai-wat-phra-doi-suthep.html
11534	2022-08-10T08:22:00	Endonezya&#8217;nın Aktif Volkanı Rinjani Dağı	https://yoldaolmak.com/mount-rinjani.html
50437	2022-08-07T08:34:00	Oslob Gezi Rehberi	https://yoldaolmak.com/oslob-gezi-rehberi.html
207579	2022-08-06T08:31:00	Hattuşaş Antik Kenti	https://yoldaolmak.com/hattusas-antik-kenti.html
2202	2022-08-05T08:25:00	Batad Köyü – Bangaan Köyü Trekking	https://yoldaolmak.com/batad-bangaan-trekking.html
207553	2022-08-02T08:23:00	Rhodiapolis Antik Kenti	https://yoldaolmak.com/rhodiapolis-antik-kenti.html
9914	2022-08-01T08:22:00	Kahramanlar Meydanı: Hösök Tere, Budapeşte	https://yoldaolmak.com/kahramanlar-meydani-budapeste.html
17210	2022-08-01T08:11:00	Filipinlilerin Dolmuşu: Jeepney	https://yoldaolmak.com/jeepney-filipinler.html
188533	2022-07-30T08:33:00	Ronda Gezilecek Yerler	https://yoldaolmak.com/ronda-gezilecek-yerler.html
207512	2022-07-30T08:11:00	Tripolis Antik Kenti	https://yoldaolmak.com/tripolis-antik-kenti.html
161911	2022-07-30T08:08:00	Estonya Gezilecek Yerler	https://yoldaolmak.com/estonya-gezilecek-yerler.html
207507	2022-07-29T08:11:00	Kaklık Mağarası	https://yoldaolmak.com/kaklik-magarasi.html
2866	2022-07-27T08:57:00	Tayland Vizesi Nasıl Alınır	https://yoldaolmak.com/tayland-vizesi.html
34716	2022-07-25T08:12:00	UNESCO Mirası Ohri Gölü, Makedonya	https://yoldaolmak.com/ohrid-golu-makedonya.html
188617	2022-07-24T08:22:00	Sicilya Gezilecek Yerler	https://yoldaolmak.com/sicilya-gezilecek-yerler.html
3818	2022-07-23T08:24:00	Başka Türlü Bir Kasaba: Vang Vieng	https://yoldaolmak.com/vang-vieng-gezilecek-yerler.html
2936	2022-07-22T08:44:00	Singapur&#8217;un Eğlence Dünyası: Sentosa Adası	https://yoldaolmak.com/santosa-adasi.html
197338	2022-07-19T08:26:00	İskoçya Gezilecek Yerler	https://yoldaolmak.com/iskocya-gezilecek-yerler.html
162206	2022-07-16T08:44:00	UNESCO Mirası Sveti Naum Manastırı, Ohrid	https://yoldaolmak.com/sveti-naum-manastiri-ohrid.html
57201	2022-07-03T08:01:00	Likya&#8217;nın Mirası: Xanthos Antik Kenti	https://yoldaolmak.com/xanthos-antik-kenti.html
162204	2022-06-30T08:23:00	Kiril Alfabesinin Doğduğu Yer: Aziz Panteleimon Kilisesi	https://yoldaolmak.com/saint-panteleimon-kilisesi-ohrid.html
179528	2022-06-29T00:02:00	Elizabeth Kulesi: Big Ben, Londra	https://yoldaolmak.com/big-ben-londra.html
20026	2022-06-27T09:00:15	Belgrad Gece Hayatı: Bar, Restoran ve Klüpler	https://yoldaolmak.com/belgrad-gece-hayati-sirbistan-geceleri.html
184031	2022-06-23T08:33:00	Verona Gezilecek Yerler	https://yoldaolmak.com/verona-gezilecek-yerler.html
51558	2022-06-17T08:30:00	Dünyanın En Güzel Köprülerinden Helix Bridge, Singapur	https://yoldaolmak.com/helix-koprusu-singapur.html
174006	2022-06-14T19:02:19	Yunan Adaları Vizesiz Gemi Turu: Patmos, Girit, Santorini, Atina ve Girit	https://yoldaolmak.com/vizesiz-yunan-adalari-turu.html
2887	2022-06-13T08:17:00	Singapur&#8217;daki Hindistan: Little India	https://yoldaolmak.com/little-india-singapur.html
180882	2022-06-11T08:25:00	Singapur Hayvanat Bahçesi	https://yoldaolmak.com/singapur-hayvanat-bahcesi.html
18687	2022-06-07T08:30:00	Singapur Marina Bay ve Marina Bay Sands	https://yoldaolmak.com/marina-bay-singapur.html
2373	2022-06-04T08:02:00	Sarong Nedir?	https://yoldaolmak.com/sarong-nedir.html
205764	2022-06-01T08:11:01	Güney Şelalesi Tabiat Anıtı	https://yoldaolmak.com/guney-selalesi-tabiat-aniti.html
179571	2022-05-31T08:10:00	Londra&#8217;nın Antik Eserler Müzesi: British Museum	https://yoldaolmak.com/british-museum-londra.html
50383	2022-05-27T09:00:00	Prag Astronomik Saat ve Hikayesi	https://yoldaolmak.com/prag-astronomik-saat-hikayesi.html
43539	2022-05-20T08:44:00	Yaşayan Taş: Lithops	https://yoldaolmak.com/yasayan-tas-lithops.html
88696	2022-05-06T08:08:00	Singapur Ulusal Orkide Bahçesi	https://yoldaolmak.com/singapur-ulusal-orkide-bahcesi.html
149893	2022-04-19T08:40:00	Singapur Alışveriş Rehberi	https://yoldaolmak.com/singapur-alisveris-rehberi.html
26427	2022-04-15T08:17:00	Başçarşının Sembolü: Başçarşı Sebili, Saraybosna	https://yoldaolmak.com/bascarsi-sebili-saraybosna-bosna-hersek.html
90417	2022-04-04T08:40:00	Singapur&#8217;un Çinli Yüzü: Chinatown	https://yoldaolmak.com/singapur-chinatown.html
46857	2022-03-30T08:57:09	Singapur&#8217;un Ünlü Kokteyli: Singapore Sling	https://yoldaolmak.com/singapore-sling.html
37747	2022-03-28T08:03:00	Birinci Dünya Savaşına Yol Açan Şoför: Arşidükün Otomobili Yanlış Yola Girince	https://yoldaolmak.com/birinci-dunya-savasi-nasil-cikti.html
14825	2022-03-18T08:11:00	Cenang Beach, Langkawi Adaları, Malezya	https://yoldaolmak.com/langkawi-adalari-cenang-beach-malezya.html
14851	2022-03-16T08:38:00	Pregnant Lady Lake (Hamile Kız Gölü), Langkawi	https://yoldaolmak.com/pregnant-lady-lake-hamile-kiz-golu-langkawi.html
9418	2022-03-14T08:00:00	Paris Eyfel Kulesi Hakkında İlginç Bilgiler	https://yoldaolmak.com/paris-eyfel-kulesi.html
52244	2022-03-13T17:34:00	Namibya&#8217;nın İlginç Kabilesi Himbalar	https://yoldaolmak.com/himbalar.html
3959	2022-03-03T08:10:00	Damladan Deryaya: Mekong Nehri	https://yoldaolmak.com/mekong-nehri.html
153825	2022-02-28T08:14:00	Venedik Hakkında Bilgiler	https://yoldaolmak.com/venedik-hakkinda-bilgiler.html
211978	2022-02-26T13:55:22	Afrika’da Görülmesi Gereken 12 Ülke	https://yoldaolmak.com/afrika-gezilecek-ulkeler.html
11575	2022-02-21T15:46:00	Paris Ressamlar Tepesi: Montmartre	https://yoldaolmak.com/montmartre-paris.html
9493	2022-02-20T09:00:00	Roma Tarihinin En İhtişamlı Yapıtı: Kolezyum	https://yoldaolmak.com/kolezyum-roma.html
154110	2022-02-16T09:00:00	Ortodoksluğun Kalbi: Fener Rum Patrikhanesi, İstanbul	https://yoldaolmak.com/fener-rum-patrikhanesi-istanbul.html
148938	2022-02-13T08:28:00	Fransa Hakkında Bilgiler	https://yoldaolmak.com/fransa-hakkinda-bilgiler.html
140245	2022-02-10T15:24:00	Roma Katolik Dünyasının Ana Kiliselerinden: San Giovanni in Laterano	https://yoldaolmak.com/san-giovanni-in-laterano-kilisesi.html
147775	2022-02-10T09:16:00	Roma&#8217;nın Kültürel ve Tarihi Birikimi: Antik Roma	https://yoldaolmak.com/antik-roma.html
36652	2022-02-10T09:00:00	Gürcü Pidesi: Haçapuri	https://yoldaolmak.com/hacapuri-tarifi-video.html
211864	2022-01-20T10:01:33	Piramitlerden Bile Eski: Devlerin İnşa Ettiği Ggantija Tapınakları	https://yoldaolmak.com/ggantija-tapinagi.html
131485	2022-01-07T08:41:00	Van Gogh Müzesi, Amsterdam	https://yoldaolmak.com/van-gogh-muzesi-amsterdam.html
154135	2021-12-02T09:00:00	Amsterdam&#8217;ın Kalbi: Dam Meydanı	https://yoldaolmak.com/dam-meydani.html
2037	2021-11-13T08:05:00	Pasaport Süresi: Pasaport Yenileme Hikayem	https://yoldaolmak.com/pasaport-nasil-yenilenir.html
54217	2021-11-03T09:00:00	Huzurun Adı: Vondelpark, Amsterdam	https://yoldaolmak.com/vondelpark-amsterdam.html
179553	2021-11-01T09:56:00	Hem Saray Hem Kale Hem Hapishane: Tower of London, Londra	https://yoldaolmak.com/londra-kulesi.html
179541	2021-10-30T08:52:00	Antik Roma Şaheseri: Pantheon, Roma	https://yoldaolmak.com/pantheon-roma.html
153860	2021-10-18T08:18:00	Madrid Hakkında Bilgiler	https://yoldaolmak.com/madrid-hakkinda-bilgiler.html
162137	2021-10-17T09:00:00	Avrupa&#8217;nın En Güzel Doğal Güzelliklerinden Biri: Plitvice Gölleri, Hırvatistan	https://yoldaolmak.com/plitvice-golleri.html
17538	2021-09-19T08:55:00	Bağ-ı İrem: İrem Bağları, Şiraz, İran	https://yoldaolmak.com/irem-baglari-siraz-iran.html
154384	2021-08-15T09:00:00	Amsterdam Müzeleri	https://yoldaolmak.com/amsterdam-muzeleri.html
36326	2021-08-01T09:00:00	Amsterdam Gece Hayatı	https://yoldaolmak.com/amsterdam-gece-hayati.html
157521	2021-07-02T09:00:00	Helsinki’nin Mücevheri: Suomenlinna Adası	https://yoldaolmak.com/suomenlinna-adasi.html
39901	2021-06-30T09:00:00	Puglia&#8217;nın Ünlü Trulli Evleri	https://yoldaolmak.com/trulli-evleri.html
54231	2021-05-25T09:00:00	Amsterdam&#8217;ın UNESCO Dünya Mirası Kanalları	https://yoldaolmak.com/amsterdam-kanallari.html
9383	2021-04-20T08:22:00	Avrupa Sanatının Hikayesi: London National Gallery	https://yoldaolmak.com/national-gallery-londra.html
154909	2021-04-17T08:18:00	Filipinler&#8217;in Tarihsel Simgesel Yapısı: Aziz Agustin Kilisesi, Manila	https://yoldaolmak.com/aziz-agustin-kilisesi-manila.html
46105	2021-03-13T09:00:00	Roma’nın En Popüler Çeşmesi: Fontana Di Trevi	https://yoldaolmak.com/trevi-ask-cesmesi-roma.html
36323	2021-03-01T08:01:00	Şiraz Kapalı Çarşısı: Bazar-ı Vekil ve Vekil Camii	https://yoldaolmak.com/bazari-vekil-vekil-camii-siraz.html
55383	2021-02-20T09:00:00	Prag Gece Hayatı	https://yoldaolmak.com/prag-gece-hayati.html
90797	2021-01-25T15:26:00	Vatikan Bahçeleri: Giardini Vaticani, Vatikan	https://yoldaolmak.com/vatikan-bahceleri.html
16258	2021-01-08T09:10:00	Şiraz&#8217;da Göz Kamaştıran Güzellik: Şah Çerağ Türbesi	https://yoldaolmak.com/sah-cerag-turbesi-siraz.html
16325	2021-01-06T08:58:00	Kerim Han Kalesi, Şiraz	https://yoldaolmak.com/kerim-han-kalesi-siraz.html
160029	2020-12-28T08:01:00	Eskişehir Gezilecek Yerler	https://yoldaolmak.com/eskisehir-gezilecek-yerler.html
167485	2020-12-03T08:11:33	Lviv Gezilecek Yerler	https://yoldaolmak.com/lviv-gezilecek-yerler.html
