20512	2020-01-13T08:11:00	Mali Gezi Rehberi	https://yoldaolmak.com/mali-gezi-rehberi.html
180365	2020-01-13T08:09:58	Hisarönü Nerede 📍 Hisarönü Nasıl Gidilir, Marmaris	https://yoldaolmak.com/hisaronu-nerede-hisaronu-nasil-gidilir-marmaris.html
180322	2020-01-10T08:36:32	Santa Maria Maggiore Bazilikası, Roma	https://yoldaolmak.com/santa-maria-maggiore-bazilikasi-roma.html
154105	2020-01-08T15:35:00	Katar&#8217;ın Şık Yaşam Merkezi: The Pearl-Qatar, Doha	https://yoldaolmak.com/the-pearl-qatar-doha.html
90790	2020-01-07T22:05:00	Aziz Petrus Meydanı: San Pietro, Vatikan	https://yoldaolmak.com/aziz-petrus-meydani-vatikan.html
180326	2020-01-07T15:37:40	Torba Nerede 📍 Torba&#8217;ya Nasıl Gidilir, Bodrum	https://yoldaolmak.com/torba-nerede-torbaya-nasil-gidilir-bodrum.html
150373	2020-01-06T16:10:00	Viyana Sanat Tarihi Müzesi: Kunsthistorisches Museum	https://yoldaolmak.com/viyana-sanat-tarihi-muzesi.html
13565	2020-01-05T13:00:00	Adana Müzesi: Adana Arkeoloji Müzesi ve Adana Etnografya Müzesi	https://yoldaolmak.com/adana-muzesi.html
13571	2020-01-05T08:00:00	Adana Kuruköprü Anıt Müzesi	https://yoldaolmak.com/adana-kurukopru-anit-muzesi.html
90714	2020-01-03T17:19:00	Palatino Tepesi, Antik Roma	https://yoldaolmak.com/palatino-tepesi-antik-roma.html
153980	2020-01-03T09:16:16	Sığla Ağacı Hakkında Bilgiler	https://yoldaolmak.com/sigla-agaci-nedir.html
54541	2020-01-01T09:58:33	Adana&#8217;nın Simgesi: Taşköprü	https://yoldaolmak.com/adana-tas-kopru.html
178294	2019-12-31T08:44:15	Kütahya Nerede 📍 Kütahya&#8217;ya Nasıl Gidilir	https://yoldaolmak.com/kutahya-nerede-kutahyaya-nasil-gidilir.html
155030	2019-12-28T08:27:20	Sarıkamış’ta Bir Baltık Yapısı: Katerina Köşkü, Kars	https://yoldaolmak.com/katerina-kosku-kars.html
155041	2019-12-24T08:27:04	Ebul Hasan Harakani Türbesi, Kars	https://yoldaolmak.com/ebul-hasan-harakani-turbesi-kars.html
170621	2019-12-20T08:50:30	Avustralya Yerlileri: Aborijinler	https://yoldaolmak.com/aborjinler.html
167221	2019-12-16T08:07:24	Prag&#8217;da Nerede Kalınır	https://yoldaolmak.com/pragda-nerede-kalinir.html
178270	2019-12-11T08:30:38	Aksaray Nerede 📍 Aksaray&#8217;a Nasıl Gidilir	https://yoldaolmak.com/aksaray-nerede-aksaraya-nasil-gidilir.html
160761	2019-12-04T08:51:44	İzmir Kordon	https://yoldaolmak.com/izmir-kordon.html
167530	2019-11-28T08:25:15	Açık Hava Sanat Galerisi Tadında Bir Yer: Lychakiv Mezarlığı, Lviv	https://yoldaolmak.com/lychakiv-mezarligi-lviv.html
155097	2019-11-26T08:57:06	Doğu&#8217;nun Ayasofyası: Kümbet Camii (Havariler Kilisesi), Kars	https://yoldaolmak.com/kumbet-camii-kars.html
178284	2019-11-25T08:34:42	Uşak Nerede 📍 Uşak&#8217;a Nasıl Gidilir	https://yoldaolmak.com/usak-nerede-usak-nasil-gidilir.html
178281	2019-11-23T08:33:52	Kırşehir Nerede 📍 Kırşehir&#8217;e Nasıl Gidilir	https://yoldaolmak.com/kirsehir-nerede-kirsehire-nasil-gidilir.html
168107	2019-11-20T08:18:24	Madrid&#8217;de Yemek Molası: Mercado San Miguel	https://yoldaolmak.com/mercado-san-miguel-madrid.html
178301	2019-11-13T08:47:46	Erzincan Nerede 📍 Erzincan&#8217;a Nasıl Gidilir	https://yoldaolmak.com/erzincan-nerede-erzincana-nasil-gidilir.html
177997	2019-11-11T08:58:19	Nevşehir Nerede 📍 Nevşehir&#8217;e Nasıl Gidilir	https://yoldaolmak.com/nevsehir-nerede-nevsehire-nasil-gidilir.html
173991	2019-11-06T08:43:20	Tokyo Nerede📍Tokyo&#8217;ya Nasıl Gidilir	https://yoldaolmak.com/tokyo-nerede-tokyoya-nasil-gidilir.html
179536	2019-11-04T08:49:12	Giresun Nerede 📍 Giresun&#8217;a Nasıl Gidilir	https://yoldaolmak.com/giresun-nerede-giresun-nasil-gidilir.html
179543	2019-11-02T15:51:54	Londra&#8217;nın Kalbi: Trafalgar Meydanı, Londra	https://yoldaolmak.com/trafalgar-meydani-londra.html
179558	2019-11-01T15:00:06	Viyana&#8217;nın Eğlence Parkı: Prater Park ve Dev Dönme Dolap	https://yoldaolmak.com/viyana-prater-park.html
179560	2019-10-31T19:00:33	Paris Eğlence Hayatına Yön Vermiş Mekan: Moulin Rouge	https://yoldaolmak.com/moulin-rouge-paris.html
179549	2019-10-31T13:56:55	Temenni Tepesi ve Anıt Mezarları, Ürgüp	https://yoldaolmak.com/temenni-tepesi-urgup.html
180561	2019-10-30T08:01:43	Paris&#8217;in Sembol Yapılarından Notre Dame Katedrali	https://yoldaolmak.com/notre-dame-katedrali-paris.html
178305	2019-10-28T15:49:37	Rize Nerede 📍 Rize&#8217;ye Nasıl Gidilir	https://yoldaolmak.com/rize-nerede-rizeye-nasil-gidilir.html
179547	2019-10-27T07:40:03	Damat İbrahim Paşa Külliyesi, Nevşehir	https://yoldaolmak.com/damat-ibrahim-pasa-kulliyesi-nevsehir.html
161844	2019-10-26T14:02:11	Kıbrıs Nerede 📍 Kıbrıs&#8217;a Nasıl Gidilir	https://yoldaolmak.com/kibris-nerede-kibrisa-nasil-gidilir.html
178299	2019-10-26T06:30:05	Ordu Nerede 📍 Ordu&#8217;ya Nasıl Gidilir	https://yoldaolmak.com/ordu-nerede-orduya-nasil-gidilir.html
163702	2019-10-25T14:05:08	Yavuz Sultan Selim Cami, İstanbul	https://yoldaolmak.com/yavuz-sultan-selim-camii-istanbul.html
179614	2019-10-25T05:45:06	Sabancı Merkez Camii ve Merkez Park, Adana	https://yoldaolmak.com/sabanci-merkez-camii-adana-merkez-park.html
179604	2019-10-24T08:45:20	Misis Mozaik Müzesi, Adana	https://yoldaolmak.com/misis-mozaik-muzesi-adana.html
161869	2019-10-23T15:14:17	Kiev Nerede 📍 Kiev&#8217;e Nasıl Gidilir	https://yoldaolmak.com/kiev-nerede-kieve-nasil-gidilir.html
175406	2019-10-23T03:22:30	Sao Jorge Kalesi, Lizbon	https://yoldaolmak.com/sao-jorge-kalesi-lizbon.html
178292	2019-10-22T15:43:36	Eskişehir Nerede 📍 Eskişehir&#8217;e Nasıl Gidilir	https://yoldaolmak.com/eskisehir-nerede-eskisehire-nasil-gidilir.html
178266	2019-10-21T15:29:32	Çanakkale Nerede 📍 Çanakkale&#8217;ye Nasıl Gidilir	https://yoldaolmak.com/canakkale-nerede-canakkaleye-nasil-gidilir.html
149159	2019-10-17T07:45:23	Prag&#8217;ın Sembolü: Charles Köprüsü	https://yoldaolmak.com/karl-koprusu-prag.html
178308	2019-10-09T14:15:05	Köyceğiz Nerede 📍 Köyceğiz&#8217;e Nasıl Gidilir	https://yoldaolmak.com/koycegiz-nerede-koycegize-nasil-gidilir.html
178024	2019-10-08T23:10:16	Didim Nerede 📍 Didim&#8217;e Nasıl Gidilir	https://yoldaolmak.com/didim-nerede-didime-nasil-gidilir.html
171584	2019-10-01T16:30:29	Erzurum Nerede📍 Erzurum&#8217;a Nasıl Gidilir	https://yoldaolmak.com/erzurum-nerede-erzuruma-nasil-gidilir.html
154671	2019-09-22T09:13:09	Palamutbükü Nerede 📍 Palamutbükü&#8217;ne Nasıl Gidilir	https://yoldaolmak.com/palamutbuku-nerede-palamutbukune-nasil-gidilir.html
160568	2019-09-21T09:03:13	Agora İzmir	https://yoldaolmak.com/agora-izmir.html
155127	2019-09-17T09:26:21	Endüstri Tarihimizin Önemli Yapısı: Cibali Tütün Fabrikası	https://yoldaolmak.com/cibali-tutun-fabrikasi.html
154575	2019-09-10T09:30:20	Fener Rum Lisesi, İstanbul	https://yoldaolmak.com/fener-rum-lisesi-istanbul.html
161921	2019-09-04T21:04:37	Ürdün Hakkında Bilgiler	https://yoldaolmak.com/urdun-hakkinda-bilgiler.html
167504	2019-09-01T09:39:23	Lviv&#8217;in Kalbi Rynok Meydanı	https://yoldaolmak.com/rynok-meydani-lviv.html
148953	2019-08-08T09:33:42	Lizbon Gezilecek Yerler	https://yoldaolmak.com/lizbon-gezilecek-yerler.html
57534	2019-06-12T09:51:08	Çivi Kullanılmadan Yapılmış Dungan Camii, Karakol, Kırgızistan	https://yoldaolmak.com/dungan-camii-kirgizistan.html
167253	2019-06-06T09:00:32	Ukrayna Nerede 📍 Ukrayna&#8217;ya Nasıl Gidilir	https://yoldaolmak.com/ukrayna-nerede-ukraynaya-nasil-gidilir.html
54082	2019-05-23T09:14:26	İki Okyanus Akvaryumu: Two Oceans Aquarium, Cape Town	https://yoldaolmak.com/two-oceans-aquarium-cape-town.html
154675	2019-05-19T09:00:35	Termessos Antik Kenti, Antalya	https://yoldaolmak.com/termessos-antik-kenti.html
154945	2019-05-18T09:28:19	Kırgızistan Rota	https://yoldaolmak.com/kirgizistan-turu.html
162223	2019-05-15T09:00:12	Viyana’nın Simgesi : St. Stephan Katedrali,	https://yoldaolmak.com/st-stephan-katedrali-viyana.html
173061	2019-05-13T09:00:59	Türkiye&#8217;de Benzeri Olmayan Bir Konaklama: Gökçe Gemile	https://yoldaolmak.com/gokce-gemile-fethiye.html
35947	2019-05-09T09:00:56	Kapadokya&#8217;nın Doğal Narenciye Depoları	https://yoldaolmak.com/kapadokya-narenciye-depolari.html
19618	2019-04-16T09:00:50	Metropolis Antik Kenti, İzmir	https://yoldaolmak.com/metropolis-antik-kenti.html
166463	2019-04-16T09:00:02	Antik Çağın 3 Bin Yıllık Liman Kenti: Kaunos Antik Kenti, Dalyan	https://yoldaolmak.com/kaunos-antik-kenti-dalyan.html
13537	2019-03-23T09:00:37	Türkiye&#8217;nin En İyi Müzeleri	https://yoldaolmak.com/turkiyenin-en-iyi-muzeleri.html
163294	2019-03-23T09:00:20	Gözalıcı Çakırağa Konağı, Birgi	https://yoldaolmak.com/cakiraga-konagi-birgi.html
154677	2019-03-14T09:00:54	Patriça Koyu, Cunda Adası	https://yoldaolmak.com/patrica-koyu-cunda-adasi.html
152174	2019-03-12T09:00:16	Kiev Gece Hayatı	https://yoldaolmak.com/kiev-gece-hayati.html
56751	2019-03-11T09:38:24	Cehennem Kıyıları: İskelet Sahili, Namibya	https://yoldaolmak.com/iskelet-sahili-namibya.html
161932	2019-03-09T09:56:45	Kuala Lumpur Gece Hayatı	https://yoldaolmak.com/kuala-lumpur-gece-hayati.html
54516	2019-03-09T09:00:33	Atatürk Bilim ve Kültür Müzesi, Adana	https://yoldaolmak.com/ataturk-bilim-ve-kultur-muzesi-adana.html
154633	2019-02-27T09:00:27	Gürül Gürül Akan Suyuyla: Düden Şelalesi	https://yoldaolmak.com/duden-selalesi.html
154922	2019-02-14T09:00:25	Salda Gölü Nerede 📍 Salda&#8217;ya Nasıl Gidilir	https://yoldaolmak.com/salda-golu-nerede-saldaya-nasil-gidilir.html
168040	2019-01-20T09:00:07	Davraz Kayak Merkezi	https://yoldaolmak.com/davraz-kayak-merkezi.html
152058	2019-01-18T08:16:18	Datça&#8217;nın Yel Değirmenli Köyü: Kızlan	https://yoldaolmak.com/kizlan-koyu-datca.html
162016	2019-01-16T08:18:26	Madrid&#8217;in Kalbi: Plaza Mayor de Madrid	https://yoldaolmak.com/plaza-mayor-de-madrid.html
167913	2018-12-28T09:00:10	Dantel Gibi İşlenmiş Kayalıklar: Taşyaran Vadisi	https://yoldaolmak.com/tasyaran-vadisi.html
167870	2018-12-27T09:00:00	Uşak Kent Tarihi Müzesi: &#8220;Cumhuriyet’i Biz Böyle Kazandık&#8221;	https://yoldaolmak.com/usak-kent-tarihi-muzesi.html
152188	2018-12-07T09:00:54	Sanatseverlerin Viyana’da Yapması Gereken 10 Şey	https://yoldaolmak.com/viyana-muzeleri.html
155986	2018-11-08T09:00:44	Madrid&#8217;de Mısır Esintisi: Debod Tapınağı	https://yoldaolmak.com/debod-tapinagi-madrid.html
57128	2018-10-06T16:40:22	Kaya Yüzündeki Resimler: Petroglifler, Kırgızistan	https://yoldaolmak.com/petroglifler-kirgizistan.html
51423	2018-10-04T09:00:19	Tarih Boyunca Bir Kültür Mozaiği: Galata	https://yoldaolmak.com/tarih-boyunca-bir-kultur-mozaigi-aynasi-galata.html
40873	2018-10-01T08:35:41	ProntoLife Dergi Röportaj: Bir Gezginin Kaleminden Seyahat ve Blog Serüveni	https://yoldaolmak.com/prontolife-roportaj.html
54026	2018-09-27T09:00:28	Hallstatt&#8217;ın Kalbi: Marktplatz	https://yoldaolmak.com/hallstatt-marktplatz.html
152086	2018-09-12T08:01:55	Katar&#8217;da Ne Yenir	https://yoldaolmak.com/katarda-ne-yenir.html
155012	2018-09-09T09:00:53	900 Yıllık Miras: Kars Kalesi	https://yoldaolmak.com/kars-kalesi.html
48205	2018-08-28T09:00:44	Büyüleyici Göl Wolfgangsee, Salzburg	https://yoldaolmak.com/wolfgangsee-salzburg.html
56939	2018-08-26T00:52:24	Boat International Dergisi [Röportaj]	https://yoldaolmak.com/boat-international-dergisi-roportaj.html
21989	2018-08-25T00:35:17	Tokyo Gezilecek Yerler	https://yoldaolmak.com/tokyo-gezilecek-yerler.html
155852	2018-08-24T09:00:48	Selçuk Dutlu Yol	https://yoldaolmak.com/selcuk-dutlu-yol.html
53737	2018-08-20T09:00:00	Hilton İstanbul Bomonti	https://yoldaolmak.com/hilton-istanbul-bomonti.html
152150	2018-08-19T09:00:34	Red Light District, Amsterdam	https://yoldaolmak.com/red-light-district-amsterdam.html
28802	2018-07-31T09:00:22	İzmir&#8217;e Her Gelenin Tadına Bakması Gereken Lezzetler	https://yoldaolmak.com/izmir-yemek-kulturu.html
17691	2018-07-04T09:00:42	Eğlencenin Hiç Bitmediği 10 Marmaris Mekanı	https://yoldaolmak.com/marmaris-gece-hayati.html
57532	2018-05-19T15:01:19	Holy Trinity Orthodoks Katedrali, Karakol, Kırgızistan	https://yoldaolmak.com/orthodox-katedrali-karakol-kirgizistan.html
155961	2018-05-18T15:19:22	Koçkor&#8217;dan Son Göle Yolculuk Rotasından İnanılmaz Manzaralar	https://yoldaolmak.com/son-gole-yolculuk-kirgizistan.html
56204	2018-05-13T09:00:42	Antalya Konyaaltı Plajı	https://yoldaolmak.com/antalya-konyaalti-plaji.html
44380	2018-01-28T09:00:31	Melek Hotel Moda, İstanbul	https://yoldaolmak.com/melek-hotel-moda-istanbul.html
48424	2018-01-25T09:00:12	Oyster Residences, Ölüdeniz, Fethiye	https://yoldaolmak.com/oyster-residences-fethiye-oludeniz.html
52760	2018-01-19T09:00:01	Tarihi Yarımada&#8217;nın Kalbinde: Eresin Crown Hotel, İstanbul	https://yoldaolmak.com/eresin-crown-hotel-sultanahmet-istanbul.html
152044	2017-12-11T09:00:08	Stratonikeia Antik Kenti, Muğla	https://yoldaolmak.com/stratonikeia-antik-kenti-mugla.html
154442	2017-12-05T09:00:40	Karyalıların Hac Yeri: Labranda Antik Kenti	https://yoldaolmak.com/labranda-antik-kenti-mugla.html
154112	2017-12-01T09:00:57	İstanbul’da İlk Ezanın Yükseldiği Yer: Arap Camii, Galata	https://yoldaolmak.com/arap-cami-galata.html
154491	2017-11-29T08:42:41	Namib Kertenkelesi: Pachydactylus Rangei	https://yoldaolmak.com/namib-kertenkelesi-pachydactylus-rangei.html
51338	2017-11-27T09:00:26	Görkemli Hohensalzburg Kalesi, Salzburg	https://yoldaolmak.com/gorkemli-hohensalzburg-kalesi-salzburg.html
56190	2017-11-25T09:00:30	Eski Bir Ermeni Kilisesi: Yağ Camii, Adana	https://yoldaolmak.com/yag-camii-adana.html
154601	2017-11-19T09:00:31	Minsk Gece Hayatı, Belarus	https://yoldaolmak.com/minsk-gece-hayati-belarus.html
54279	2017-11-14T09:00:34	Agios Isidoros Şapeli, Sakız Adası	https://yoldaolmak.com/agios-isidoros-sakiz-adasi.html
55716	2017-11-10T14:46:06	Kırgızistan’ın Simge Anıtlarından Burana Kulesi	https://yoldaolmak.com/balasagun-burana-kulesi.html
55739	2017-10-13T12:16:59	Masal Kanyonu: Skazka, Kırgızistan	https://yoldaolmak.com/skazka-masal-kanyonu-kirgizistan.html
38908	2017-10-05T09:00:51	Sonbahar Tatili İçin En Güzel 5 Rota	https://yoldaolmak.com/sonbahar-tatili-icin-en-guzel-rotalar.html
152055	2017-10-03T09:00:10	Ay Tanrıçası Hekate&#8217;nin Evi: Lagina Hekate Antik Kenti	https://yoldaolmak.com/lagina-hekate-antik-kenti-mugla.html
55721	2017-09-26T23:17:34	Ruhların Yeri (Ruh Ordo) Müzesi, Kırgızistan	https://yoldaolmak.com/ruhlarin-yeri-ruh-ordo-muzesi-kirgizistan.html
57319	2017-09-24T15:20:05	Suntimes Magazine: Kızıldeniz’de Yükselen Rota: Hurghada	https://yoldaolmak.com/suntimes-magazine-hurghada.html
57125	2017-09-13T17:54:30	Tarihi Balasagun Şehri, Kırgızistan	https://yoldaolmak.com/tarihi-balasagun-sehri-kirgizistan.html
54721	2017-09-09T00:58:23	Milliyet Pazar Eki: Yetkin Dikinciler ile Namibya Gezisi	https://yoldaolmak.com/milliyet-pazar-eki-namibya-gezisi.html
52138	2017-09-07T09:00:54	Osmanlıya Kök Söktürmüş Arnavut: İskender Bey	https://yoldaolmak.com/arnavut-iskender-bey.html
24066	2017-08-14T09:00:12	İskeçe Karnavalı Rehberi	https://yoldaolmak.com/iskece-festivali-rehberi.html
55833	2017-08-10T09:00:06	Milliyet Rota: Mavinin Elli Tonu Fethiye	https://yoldaolmak.com/milliyet-rota-mavinin-elli-tonu-fethiye.html
31818	2017-07-23T09:00:25	En İyi 10 Bodrum Gece Hayatı Mekanı	https://yoldaolmak.com/bodrum-gece-hayati-mekanlari.html
28353	2017-07-08T09:00:23	İstanbul&#8217;da Tatil Yapın	https://yoldaolmak.com/istanbulda-tatil-yapin.html
16644	2017-06-23T11:00:39	Göz Alıcı Çelik ve Cam: Petronas İkiz Kuleleri	https://yoldaolmak.com/petronas-twin-towers.html
55724	2017-06-19T12:46:47	Kırgızistan&#8217;ın Değerli Gölü: Issık Kul	https://yoldaolmak.com/issik-kul-kirgizistan.html
53967	2017-02-20T14:51:32	Daily Sabah: Turkish &#8216;Digital Nomad&#8217; Shares Life Philosophy [Röportaj]	https://yoldaolmak.com/daily-sabah-roportaj.html
53170	2017-01-11T16:15:20	Dünyanın En Güzel Kıyı Şeritlerinden Garden Route, Güney Afrika	https://yoldaolmak.com/garden-route-guney-afrika.html
52496	2017-01-08T12:29:14	Anadolu Ajansı Röportajı: &#8217;14 Yıllık Profesyonel İş Hayatımı Bıraktım ve Dünyayı Geziyorum&#8217;	https://yoldaolmak.com/anadolu-ajansi-roportaji-14-yillik-profesyonel-is-hayatimi-biraktim-dunyayi-geziyorum.html
32386	2016-09-24T11:10:31	Ashikaga Flower Park, Japonya	https://yoldaolmak.com/japon-bahceleri-resimleri-ashikaga.html
39534	2016-08-03T09:00:45	Doğanın Kalbinde: Dombay, Rusya	https://yoldaolmak.com/dombay-rusya.html
49785	2016-08-02T23:59:26	Doğu Afrika’dan Göz Alıcı 12 UNESCO Dünya Mirası Yer	https://yoldaolmak.com/dogu-afrika-gorulecek-unesco-mirasi-yerler.html
24652	2016-08-01T12:37:54	Kızıldeniz’in Tropikal Adası: Giftun Adaları	https://yoldaolmak.com/giftun-adasi-mahmya-beach.html
48825	2016-07-08T00:45:08	Qatar Airways Airbus A350 ile Business Class Deneyimi	https://yoldaolmak.com/qatar-airways-airbus-a350-ile-business-class-deneyimi.html
48373	2016-05-25T19:51:43	Adelaide Zoo: Panda ve Koala	https://yoldaolmak.com/panda-koala-adelaide-zoo.html
27133	2016-05-20T09:00:24	Dünyanın En Büyük Tematik Akvaryumu: İstanbul Akvaryum	https://yoldaolmak.com/istanbul-akvaryum.html
40807	2016-05-18T09:00:46	Almanya&#8217;da Bir Osmanlı Müzesi: Türckische Cammer, Dresden	https://yoldaolmak.com/turckische-cammer-dresden.html
48001	2016-04-29T16:25:05	Perfect Life Teknesi ile Şahane Mavi Tur, Göcek	https://yoldaolmak.com/perfect-life-teknesi-mavi-tur-gocek.html
36133	2016-03-30T10:41:05	yenimedya.co  [Röportaj]	https://yoldaolmak.com/yenimedya-co-roportaji.html
47048	2016-03-13T08:00:39	Sheridan Beach Resort, Palawan [review]	https://yoldaolmak.com/sheridan-beach-resort-palawan.html
11200	2016-03-01T09:00:26	Çırağan Palace Kempinski İstanbul	https://yoldaolmak.com/ciragan-palace-kempinski-istanbul.html
35945	2016-02-21T09:00:24	Kapadokya Turları: Sarı Tur	https://yoldaolmak.com/kapadokya-turlari-kapadokya-sari-tur.html
45210	2016-01-18T23:27:17	🎙 TRT  Radyo 1 Öğrenci İşleri Programına Tekrar Konuk Oldum	https://yoldaolmak.com/yolda-olmak-trt-radyo1-ogrenci-isleri-programi.html
44605	2016-01-13T09:00:59	Regie Ottoman Hotel Istanbul	https://yoldaolmak.com/regie-ottoman-hotel-istanbul.html
21987	2015-12-07T09:00:29	Tokyo Yemekleri ve Yemek Kültürü	https://yoldaolmak.com/tokyo-yemekleri-ve-yemek-kulturu.html
21984	2015-12-06T12:00:14	Tokyo&#8217;da Alışveriş Yapılacak Yerler	https://yoldaolmak.com/tokyo-alisveris.html
30688	2015-12-02T09:00:24	Nowy Efendi Otel, İstanbul	https://yoldaolmak.com/efendi-otel-istanbul-review.html
39009	2015-10-17T22:48:23	MEB Yeğitek Dergisi: Dilemma: Gezgin Olmak	https://yoldaolmak.com/meb-yegitek-dergisi-dilemma-gezgin-olmak.html
27804	2015-10-17T21:07:33	Extreme Sailing Series: 6. Adam Olmak	https://yoldaolmak.com/istanbul-extreme-sailing-series-6-adam-olmak.html
38517	2015-10-15T09:00:11	Ukrayna&#8217;yı Dünyaya Bağlayan Kapı: Herson	https://yoldaolmak.com/herson-kherson-ukrayna.html
39084	2015-10-13T09:00:12	Kherson Nerede 📍 Kherson’a Nasıl Gidilir	https://yoldaolmak.com/ukrayna-kherson-nasil-gidilir.html
40343	2015-10-01T09:00:01	Avrupa&#8217;nın En Eski Kafelerinden: Arap Kahve Ağacı, Leipzig	https://yoldaolmak.com/zum-arabischen-coffe-baum-leipzig.html
40324	2015-09-28T09:00:40	Bach&#8217;ın Kilisesi: St. Thomas, Leipzig	https://yoldaolmak.com/st-thomas-kilisesi-thomaskirche.html
40046	2015-09-27T09:00:36	Bach Müzesi: Bosehaus, Leipzig	https://yoldaolmak.com/bach-muzesi-bosehaus-leipzig.html
40044	2015-09-27T09:00:11	Martin Luther&#8217;in Vaaz Verdiği Kilise: St. Nicholas Kilisesi, Leipzig	https://yoldaolmak.com/st-nicholas-kilisesi-leipzig.html
36142	2015-09-25T09:00:49	Yağmurda Müzik Çalan Bina: Music House, Dresden	https://yoldaolmak.com/yagmur-yagdiginda-muzik-calan-bina-music-house-dresden.html
40051	2015-09-25T09:00:16	Uluslar Muharebesi Anıtı ve Augustusplatz, Leipzig	https://yoldaolmak.com/uluslar-muharebesi-aniti-leipzig.html
40078	2015-09-25T09:00:04	City-Hochhaus: Leipzig Üniversitesi Kulesi	https://yoldaolmak.com/leipzig-universitesi-kulesinden-leipzig-manzarasi.html
39410	2015-09-23T09:00:34	Kherson’da Gezilecek Yerler, Ukrayna	https://yoldaolmak.com/ukrayna-herson-gezilecek-yerler.html
39721	2015-09-22T09:00:34	Dünyanın En Güzel Göllerinden Birisi: Tumanly-Kel, Dombay	https://yoldaolmak.com/tumanly-kel-sisli-gol-dombay.html
39746	2015-09-22T09:00:18	Tumanly-Kel, Dombay, Rusya	https://yoldaolmak.com/tumanly-kel-dombay-rusya.html
39644	2015-09-21T09:00:55	Alibek Buzulu, Teberda Tabiat Parkı	https://yoldaolmak.com/alibek-buzulu-teberda-tabiat-parki.html
39590	2015-09-21T09:00:45	Alibek Şelalesi, Dombay	https://yoldaolmak.com/alibek-selalesi-dombay.html
39704	2015-09-21T09:00:39	Amanauz Vadisi ve Sofrudzhu Dağı, Dombay	https://yoldaolmak.com/amanauz-vadisi-mount-sofrudzhu-dombay.html
39620	2015-09-21T09:00:35	Teberda Tabiat Parkı, Dombay, Rusya	https://yoldaolmak.com/teberda-tabiat-parki-dombay-rusya.html
39698	2015-09-21T09:00:25	Kap Zirvesi, Dombay	https://yoldaolmak.com/peak-kap-zirvesi-dombay.html
39661	2015-09-21T09:00:19	Teberda ve Dombay&#8217;da ATV Turu	https://yoldaolmak.com/teberda-ve-dombayda-atv-turu.html
39691	2015-09-21T09:00:15	Gora Sulakhat, Dombay	https://yoldaolmak.com/gora-sulakhat-dombay.html
39206	2015-09-13T09:00:18	Güzeldere Şelalesi, Düzce	https://yoldaolmak.com/guzeldere-selalesi-duzce.html
36127	2015-09-09T09:00:20	Goethe&#8217;nin Restoranı: Auerbachs Keller	https://yoldaolmak.com/auerbachs-keller.html
36106	2015-09-08T09:00:30	Zeplin Müzesi, Friedrichshafen	https://yoldaolmak.com/zeplin-muzesi-friedrichshafen.html
35351	2015-08-31T09:00:28	Stavrapol Nerede 📍 Stavropol&#8217;a Nasıl Gidilir	https://yoldaolmak.com/stavropol-nasil-gidilir-ulasim.html
30136	2015-08-29T09:00:15	Radisson Blu Hotel İstanbul Tuzla	https://yoldaolmak.com/radisson-blu-hotel-istanbul-tuzla.html
35886	2015-07-29T09:00:54	Sanatorium Mashuk Aqua-Therm, Pyatigorsk, Rusya	https://yoldaolmak.com/sanatorium-mashuk-aqua-therm-pyatigorsk-rusya.html
35944	2015-07-29T00:49:48	Travel + Leisure Dergisi: Kızıldeniz&#8217;de 45 Gün	https://yoldaolmak.com/travel-leisure-dergisi-ayaginin-tozuyla.html
34929	2015-07-01T09:00:58	Yanıklar Köyünde Enfes Bir Eko Butik Otel: Yonca Lodge, Fethiye	https://yoldaolmak.com/yonca-lodge-yaniklar-fethiye.html
32968	2015-06-07T09:00:01	Kızıldeniz Tekne Turu, Şarm El Şeyh	https://yoldaolmak.com/kizildeniz-tekne-turu-sarm-el-seyh.html
32950	2015-06-06T09:00:33	Sina Çölü&#8217;nde ATV Safari Keyfi, Şarm El Şeyh	https://yoldaolmak.com/sina-colunde-atv-safari-sarm-el-seyh.html
280	2015-05-18T09:08:12	Neredeydim: 685 Gün Süren Dünya Turu Rotam	https://yoldaolmak.com/neredeydim.html
32366	2015-05-08T09:00:43	Taşkonaklar Butik Otel, Kapadokya	https://yoldaolmak.com/taskonaklar-butik-otel-kapadokya.html
32345	2015-05-07T15:05:04	Sırt Çantalı Seyahat Felsefem – World Wide Traveller Söyleşisi	https://yoldaolmak.com/sirt-cantali-seyahat-world-wide-traveller-roportaj.html
32295	2015-05-05T09:00:57	Arno Valley Otel, Mustafapaşa	https://yoldaolmak.com/arno-valley-otel-mustafapasa.html
31976	2015-04-15T09:00:00	Jerveni Cave Hotel, Kapadokya	https://yoldaolmak.com/jerveni-cave-hotel-kapadokya.html
8361	2015-04-10T17:15:57	Ben Ne Yapıyorum? Kısa Hayat, Uzun Yol: Benim Seçimim Bu!	https://yoldaolmak.com/ben-ne-yapiyorum.html
27577	2015-04-04T22:22:17	Havana: Bir Uçuşla Zamanda Yolculuk Mümkün!	https://yoldaolmak.com/havana-bir-ucusla-zamanda-yolculuk-mumkun.html
30253	2015-02-12T23:53:09	Sevgililer Günü Tatili	https://yoldaolmak.com/sevgililer-gunu-tatili.html
30189	2015-01-30T19:18:22	YoldaOlmak.com En Çalışkan Blog Ödülü Aldı 🥇	https://yoldaolmak.com/yoldaolmak-com-hurriyet-online-sayfalarinda.html
30180	2015-01-30T14:25:18	Yolda Olmak Hürriyet Kelebek’te: Gurur Dolu Anlar 🗞	https://yoldaolmak.com/yoldaolmak-com-hurriyet-kelebek-ekinde.html
26609	2015-01-17T09:00:38	Dünyanın En Kalabalık Su Yolu: İstanbul Boğazı	https://yoldaolmak.com/dunyanin-en-kalabalik-su-yolu-istanbul-bogazi.html
21835	2015-01-15T09:00:39	Farklı Bir Dizayn Oteli: Aloft Hotel Bursa	https://yoldaolmak.com/aloft-bursa-hotel.html
27194	2015-01-05T16:30:06	Üst Sınıf Yolculuk Tecrübesi: THY Business Class	https://yoldaolmak.com/ust-sinif-yolculuk-tecrubesi-thy-business-class.html
28390	2015-01-01T13:41:02	The Oberoi Sahl Hesheesh Otel, Hurghada	https://yoldaolmak.com/oberoi-sahl-hesheesh-otel-hurghada.html
26956	2014-11-26T23:53:04	Çiçek Satan Çocuk, Sidi Bou Said, Tunus	https://yoldaolmak.com/cicek-satan-cocuk-sidi-bou-said-tunus.html
28062	2014-11-26T23:06:15	Bir Tren Yolculuğunun Düşündürdükleri	https://yoldaolmak.com/bir-tren-yolculugunun-dusundurdukleri.html
6862	2014-11-08T02:23:41	Rotamı Nasıl Belirliyorum? Plan Kağıtta Kalır, Hayat Rayda Gider	https://yoldaolmak.com/rotami-nasil-belirliyorum.html
6840	2014-11-07T00:19:50	Gezi Tarzım: Yolun Şekillendirdiği Bir Seyahat Tarzı	https://yoldaolmak.com/gezi-tarzim.html
6826	2014-11-06T13:03:04	Sırt Çantalı Ekonomi: Finansmanı Nasıl Sağlıyorum?	https://yoldaolmak.com/finansmani-nasil-sagliyorum.html
6770	2014-11-05T13:18:31	Sırt Çantamda Neler Var?	https://yoldaolmak.com/sirtcantamda-neler-var.html
6561	2014-11-02T22:15:07	Ne Kadar Süredir Geziyorum?	https://yoldaolmak.com/ne-kadar-suredir-geziyorum.html
34718	2014-10-26T23:51:29	15.000 Feetten Uçmak: Skydiving	https://yoldaolmak.com/skydiving-yeni-zelanda.html
34722	2014-10-24T18:45:29	Hurgada&#8217;da Dalış, Mısır	https://yoldaolmak.com/hurgada-dalis-misir.html
34717	2014-08-26T18:29:33	47 Metreden Düşmek: Bungee Jumping	https://yoldaolmak.com/47-metreden-dusmek-bungee-jumping.html
26591	2014-08-12T09:00:42	İstanbul&#8217;da Gün Batımı	https://yoldaolmak.com/istanbulda-gun-batimi.html
