19807	2026-02-02T16:58:56	Bergama Gezi Rehberi: Deneyimli Gezginden İpuçları ve Öneriler	https://yoldaolmak.com/bergama-gezilecek-yerler.html
9415	2026-02-02T15:49:55	Şanzelize Caddesi Paris: Gezilecek Yerler ve Pratik Bilgiler	https://yoldaolmak.com/sanzelize-caddesi.html
154668	2026-02-02T15:30:42	Dara Antik Kenti: Mezopotamya&#8217;nın Kaya Şehri	https://yoldaolmak.com/dara-antik-kenti.html
162027	2026-02-02T13:55:52	Malaga Gezi Rehberi: Picasso&#8217;nun Şehri	https://yoldaolmak.com/malaga.html
44194	2026-02-02T12:21:43	Porto Lagos: Yunanistan&#8217;ın Saklı Balıkçı Köyü	https://yoldaolmak.com/balikci-koyu-porto-lagos-iskece.html
44183	2026-02-02T12:03:33	Yüzen Manastır: Yunanistan&#8217;ın Suda Yüzen Manastırı	https://yoldaolmak.com/agios-nikolaos-manastiri-porto-lagos.html
44187	2026-02-02T11:37:01	Dedeağaç Nerede? Yakın Yunan Tatil Şehri Dedeağaç’a Nasıl Gidilir	https://yoldaolmak.com/dedeagac-nasil-gidilir.html
56222	2026-02-02T09:34:56	Erdemli Gezi Rehberi: Kızkalesi’nin Gölgesinde Akdeniz Havası	https://yoldaolmak.com/erdemli-gezi-rehberi.html
18060	2026-02-02T09:14:00	Batum Gezilecek Yerler: Nereleri Görmeli	https://yoldaolmak.com/batum-gezilecek-yerler.html
154408	2026-02-01T20:21:47	Çıralı Gezi Rehberi: Akdeniz&#8217;in Doğal Sığınağı	https://yoldaolmak.com/cirali.html
31571	2026-02-01T19:31:47	Mavi Yolculuk Nedir? Guletlerle Deniz Üzerinde Bir Yaşam	https://yoldaolmak.com/mavi-tur-nedir.html
15970	2026-02-01T18:54:58	Trilye Gezi Rehberi: Gezilecek Yerler, Ne Yenir, Ne Alınır	https://yoldaolmak.com/trilye-gezilecek-yerler.html
18148	2026-02-01T18:32:06	Gürcü Mutfağı: Gürcistan Yemekleri	https://yoldaolmak.com/gurcistan-yemekleri.html
17420	2026-02-01T15:52:34	Antalya Tarihi Yerler	https://yoldaolmak.com/antalya-gezilecek-tarihi-yerler.html
152029	2026-02-01T14:02:26	Yüzyıllardır Yanan Alev: Yanartaş, Çıralı	https://yoldaolmak.com/yanartas-cirali.html
175781	2026-02-01T13:48:59	Akdeniz Mavisi: En Güzel Kaş Plajları	https://yoldaolmak.com/kas-plajlari.html
48420	2026-02-01T12:19:40	Melbourne Gezi Rehberi: Dünyanın En Yaşanabilir Şehri	https://yoldaolmak.com/melbourne-gezi-rehberi.html
15967	2026-02-01T10:25:43	İsfahan: İran&#8217;ın Floransa&#8217;sı	https://yoldaolmak.com/isfahan-iran.html
20544	2026-02-01T00:54:08	Yeni Zelanda Nerede ve Nasıl Gidilir? İlk Kez Gidenler İçin Net Rehber	https://yoldaolmak.com/yeni-zelanda_ya-nasil-gidilir.html
2050	2026-02-01T00:03:46	Cook Strait Yolculuğu: 3 Saatlik Deniz Destanı	https://yoldaolmak.com/interislander-cook-strait-ferry.html
18025	2026-01-31T23:54:51	Batum&#8217;a Nasıl Gidilir – Batum&#8217;a Araçla Gidiş Rehberi	https://yoldaolmak.com/batuma-nasil-gidilir-aracla-gidis-rehberi.html
16268	2026-01-31T23:12:07	Vize Nedir: Kapsamlı Başvuru Rehberi ve Gerekli Belgeler	https://yoldaolmak.com/vize-nedir-nasil-alinir.html
202440	2026-01-31T18:54:42	Türkiye&#8217;nin Az Bilinen Harika Yerleri	https://yoldaolmak.com/turkiyede-az-bilinen-yerler.html
51787	2026-01-31T18:03:45	Bin Pencereli Şehir: Berat, Arnavutluk	https://yoldaolmak.com/berat-arnavutluk.html
161878	2026-01-31T16:58:11	Monako Gezi Rehberi	https://yoldaolmak.com/monako-gezi-rehberi.html
164570	2026-01-31T15:30:03	Selanik Nerede? Yunanistan&#8217;ın İkinci Büyük Şehrine Ulaşım Rehberi	https://yoldaolmak.com/selanik-nerede-selanik-nasil-gidilir.html
18058	2026-01-31T15:11:00	Medea Heykeli Batum: Gürcistan&#8217;ın Ünlü Mitolojik Anıtı	https://yoldaolmak.com/medea-heykeli-batum.html
3356	2026-01-31T14:35:25	Phuket Old Town: Phuket&#8217;in Gerçek Yüzü	https://yoldaolmak.com/phuket-old-town.html
36005	2026-01-31T14:15:50	Şarm El Şeyh Gece Hayatı: Barlar, Kulüpler ve Canlı Eğlence Rehberi	https://yoldaolmak.com/sarm-el-seyh-gece-hayati.html
162203	2026-01-31T13:59:32	Su Üstündeki Müze: Bay of Bones, Ohrid	https://yoldaolmak.com/bay-of-bones-ohrid.html
146744	2026-01-31T13:34:05	Kozak Yaylası Rehberi: Köyleri, Çam Fıstığı Rotası, Yapılacaklar	https://yoldaolmak.com/kozak-yaylasi.html
38127	2026-01-31T13:15:10	Zamana Yenilen Satılık Köy: Lübbey, Ödemiş	https://yoldaolmak.com/lubbey-koyu-odemis.html
20883	2026-01-31T12:44:10	Mavrovo Gezi Rehberi	https://yoldaolmak.com/mavrovo-gezi-rehberi.html
23983	2026-01-31T12:15:53	Alaçatı Hakkında Bilmediğiniz 12 Şey	https://yoldaolmak.com/alacati-hakkinda-bilgiler.html
30037	2026-01-31T12:00:07	Alaçatı Tatili Öncesi Bilinmesi Gerekenler	https://yoldaolmak.com/alacati-tatili-oncesi-bilinmesi-gerekenler.html
18172	2026-01-31T11:58:02	Batum Gece Hayatı Nasıl? Barlar, Kulüpler ve Gerçek Deneyimler	https://yoldaolmak.com/batum-gece-hayati.html
243	2026-01-30T20:11:29	Ross Village: Tazmanya’da Bir 19. Yüzyıl Köyü	https://yoldaolmak.com/19-yuzyil-koyu-ross.html
229	2026-01-30T19:28:57	Relocations: Avustralya’da Bedava Karavan Kiralama	https://yoldaolmak.com/relocations-nedir.html
48371	2026-01-30T19:13:09	Great Ocean Road Rehberi: Avustralya’nın Efsane Kıyı Rotası	https://yoldaolmak.com/great-ocean-road-avustralya.html
260	2026-01-30T17:56:32	Tazmanya-Melbourne Feribot Geçişi	https://yoldaolmak.com/tazmanya-melbourne-gecisi.html
18442	2026-01-30T15:54:33	Twelve Apostles: 12 Havari Kayalıkları, Avustralya	https://yoldaolmak.com/twelve-apostles-12-havari-avustralya.html
333	2026-01-30T14:59:08	Port Campbell National Park: Avustralya’nın Saklı Kıyı Cennetini	https://yoldaolmak.com/port-campbell-national-park.html
10080	2026-01-30T14:34:18	Melbourne Nasıl Bir Yer: Nerede, Nasıl Gidilir, Gezi Planı 🇦🇺	https://yoldaolmak.com/melbourne-nerede-melbourne-nasil-gidilir.html
51812	2026-01-30T12:29:46	Uçağı Kaçırdım Ne Yapmalıyım? | 2026 Güncel Rehber ve Çözüm Yolları	https://yoldaolmak.com/ucagi-kacirdim-bilet-iadesi.html
57364	2026-01-30T12:15:47	Aktarmalı Uçak Bileti Alırken Dikkat Edilmesi Gerekenler	https://yoldaolmak.com/aktarmali-ucak-bileti.html
181217	2026-01-29T21:07:45	Kazablanka Nasıl Bir Yer: Nerede, Nasıl Gidilir, Gezi Planı 🇲🇦	https://yoldaolmak.com/kazablanka-nerede-kazablanka-nasil-gidilir.html
27900	2026-01-29T12:04:35	En Ucuz Uçak Bileti Ne Zaman Alınır: 2026 Güncel Rehber	https://yoldaolmak.com/en-ucuz-ucak-bileti-ne-zaman-alinir.html
36040	2026-01-29T00:03:00	En Ucuz Bilet Sunan Havayolu Firmaları	https://yoldaolmak.com/en-ucuz-havayolu-sirketleri.html
178296	2026-01-28T21:51:51	Amasya Nasıl Bir Yer: Nerede, Nasıl Gidilir, Gezi Planı	https://yoldaolmak.com/amasya-nerede-amasyaya-nasil-gidilir.html
47009	2026-01-28T16:56:10	Uçak Bileti Fiyatları Nasıl Belirleniyor? Havayolları Sırları	https://yoldaolmak.com/ucak-bileti-fiyatlari-nasil-belirleniyor.html
21573	2026-01-28T12:31:45	Ucuz Uçak Bileti Nasıl Bulunur: İşe Yarayan 10 Taktik	https://yoldaolmak.com/ucuz-ucak-bileti-bulma-yollari.html
30778	2026-01-28T10:08:34	Uçakta En İyi Koltuk Hangisi: En İyi Koltuk Nasıl Seçilir	https://yoldaolmak.com/ucakta-koltuk-secimi-en-iyi-koltuk.html
155192	2026-01-28T08:47:48	Uçak Bileti Kampanyaları Nasıl Bulunur	https://yoldaolmak.com/indirimli-ucak-bileti-ve-ucak-bileti-kampanyalari-nasil-bulunur.html
170642	2026-01-28T00:30:52	Wellington Gezi Rehberi: Gezilecek En Güzel 10 Yer	https://yoldaolmak.com/wellington-gezi-rehberi.html
154665	2026-01-27T08:56:57	Yurtdışı Çıkış Harcı Nedir? 2026 Güncel Ücreti ve Ödeme Yolları	https://yoldaolmak.com/yurtdisi-cikis-harci-nedir-nereye-odenir.html
9355	2026-01-27T08:56:09	Vizesiz Ülkeler Listesi 2026 Güncel Liste	https://yoldaolmak.com/vizesiz-ulkeler-vize-istemeyen-ulkeler-guncel-liste.html
171481	2026-01-25T08:35:41	Malezya Nasıl Bir Yer: Nerede, Nasıl Gidilir, Gezi Planı	https://yoldaolmak.com/malezya-nerede-malezyaya-nasil-gidilir.html
192657	2026-01-24T08:44:45	Taraklı Gezi Rehberi: Sakarya’nın Tarihi ve Doğal Cenneti	https://yoldaolmak.com/tarakli-gezi-rehberi.html
43315	2026-01-24T08:42:25	Elbe Nehri: Dresden’in Kalbinde Akan Zaman	https://yoldaolmak.com/elbe-nehri-dresden.html
149392	2026-01-24T08:34:04	Portekiz Nerede? 🇵🇹 Portekiz’e Nasıl Gidilir, Ulaşım ve Uçuş Rehberi	https://yoldaolmak.com/portekiz-nerede-portekize-nasil-gidilir.html
51685	2026-01-24T08:22:50	Hallstatt Gezi Rehberi: Nereler Gezilir, Ne Yapılır?	https://yoldaolmak.com/hallstatt.html
49173	2026-01-24T08:16:31	Salzburg Gezi Rehberi: Mozart’ın Şehrinde Kaybolmak	https://yoldaolmak.com/salzburg.html
36131	2026-01-23T08:58:03	Leipzig Gezilecek Yerler: Sessiz ama Derin Bir Alman Şehri	https://yoldaolmak.com/leipzig-gezilecek-yerler.html
53512	2026-01-23T08:29:41	Karadağ’a Nasıl Gidilir? Karadağ Nerede, Vize, Ulaşım ve Yol Tavsiyeleri	https://yoldaolmak.com/karadaga-nasil-gidilir.html
40820	2026-01-23T08:17:14	Dresden Gezi Rehberi: Elbe Kıyısında Barok Bir Şehir	https://yoldaolmak.com/dresden.html
155577	2026-01-23T08:10:56	Gürcistan Pasaportu İle Vizesiz Gidilen Ülkeler 	https://yoldaolmak.com/gurcistan-pasaportu-ile-vizesiz-gidilen-ulkeler.html
159437	2026-01-22T08:43:34	Fethiye Tekne Turları: Rotalar ve Gezilen Yerler	https://yoldaolmak.com/fethiye-tekne-turu.html
184026	2026-01-21T20:46:14	Vatikan Nasıl Bir Yer: Nerede, Nasıl Gidilir, Gezi Planı	https://yoldaolmak.com/vatikan-nerede-vatikan-nasil-gidilir.html
170616	2026-01-21T08:38:37	Bir Tutam Akdeniz Mavisi: Göcek	https://yoldaolmak.com/gocek-gezilecek-yerler.html
46073	2026-01-21T08:32:00	Fethiye Gezi Rehberi	https://yoldaolmak.com/fethiye-gezi-rehberi.html
51299	2026-01-21T08:13:00	Fiji Nerede 📍Fiji&#8217;ye Nasıl Gidilir? Gitmeden Önce Bilmeniz Gerekenler	https://yoldaolmak.com/fiji-nerede-fijiye-nasil-gidilir.html
2044	2026-01-21T00:33:45	Huka Şelalesi: Yeni Zelanda&#8217;nın En Güçlü Şelalesi	https://yoldaolmak.com/huka-selalesi-yeni-zelanda.html
35648	2026-01-20T13:40:52	Alaçatı Gezi Rehberi: Ege&#8217;nin Renkli Taş Kasabası	https://yoldaolmak.com/alacati-yapilacak-seyler.html
27265	2026-01-15T19:44:21	Sziget Festivali: Budapeşte’nin Renkli Müzik Adası	https://yoldaolmak.com/orta-avrupa-unlu-sziget-festivali-budapeste.html
163778	2026-01-14T17:57:37	Belgrad Ormanı: İstanbul&#8217;un Yeşil Cennetinde Doğa Kaçamağı	https://yoldaolmak.com/belgrad-ormani-istanbul.html
16456	2026-01-11T12:32:00	Batum Nasıl Bir Yer: Batum&#8217;a Gideceklere Tavsiyeler	https://yoldaolmak.com/batum.html
173444	2026-01-07T10:56:54	Aristoteles Meydanı: Selanik’in Kalbi ❤️	https://yoldaolmak.com/aristoteles-meydani-selanik.html
11998	2026-01-06T08:08:00	Chiang Mai Gezi Rehberi	https://yoldaolmak.com/chiang-mai.html
49562	2026-01-05T08:12:00	Rotterdam Gezi Rehberi	https://yoldaolmak.com/rotterdam.html
54775	2026-01-05T01:16:42	Alaçatı Nasıl Bir Yer?	https://yoldaolmak.com/alacati-sokaklari.html
55687	2026-01-02T08:33:00	Antalya Gezi Rehberi	https://yoldaolmak.com/antalya.html
55500	2026-01-02T08:07:00	Fethiye Çevresinde Gezilecek Yerler	https://yoldaolmak.com/fethiye-cevresinde-gezilecek-yerler.html
211344	2025-12-30T08:31:01	Bakü Gezi Rehberi	https://yoldaolmak.com/baku-gezi-rehberi.html
155141	2025-12-28T20:01:30	Demre Gezi Rehberi	https://yoldaolmak.com/demre-gezilecek-yerler.html
242521	2025-12-18T17:07:36	İkinci El Araç: Direksiyonun Başına Geçmeden Önceki Hikâye	https://yoldaolmak.com/ikinci-el-arac.html
170315	2025-12-10T08:47:00	Phuket Nasıl Bir Yer: Nerede, Nasıl Gidilir, Gezi Planı	https://yoldaolmak.com/phuket-nerede-phukete-nasil-gidilir.html
24369	2025-11-28T08:35:00	Balat Gezilecek Yerler	https://yoldaolmak.com/balat-gezilecek-yerler.html
44439	2025-11-28T08:12:22	Kapadokya’da Yapılacak Şeyler	https://yoldaolmak.com/kapadokyada-yapilacak-seyler.html
742	2025-11-26T08:37:00	Bali’nin Kültür Başkenti: Ubud	https://yoldaolmak.com/ubud-gezilecek-yerler.html
161613	2025-11-25T09:00:07	İzmir&#8217;in En Güzel Antik Kentleri	https://yoldaolmak.com/izmir-antik-kentleri.html
11283	2025-11-25T09:00:02	İzmir Çevresi Gezilecek Yerler	https://yoldaolmak.com/izmir-cevresinde-gezilecek-yerler.html
12764	2025-11-21T08:13:00	Vizesiz Balkan Ülkeleri Listesi	https://yoldaolmak.com/vizesiz-balkan-ulkeleri.html
242501	2025-10-31T13:17:03	Ege’nin Ruhu: İzmir	https://yoldaolmak.com/egenin-ruhu-izmir.html
57359	2025-10-19T08:02:00	Kekova Gezi Rehberi	https://yoldaolmak.com/kekova.html
155415	2025-10-05T08:15:00	Sorrento Gezi Rehberi	https://yoldaolmak.com/sorrento-gezi-rehberi.html
26269	2025-10-03T10:00:01	Mısır’ın Tatil Kenti: Hurgada	https://yoldaolmak.com/hurgada.html
848	2025-10-01T08:12:00	Su Altı Cenneti: Gili Adaları	https://yoldaolmak.com/gili-adalari.html
154302	2025-09-25T08:12:00	Sırbistan Gezi Rehberi	https://yoldaolmak.com/sirbistan-gezi-rehberi.html
54529	2025-09-23T08:05:00	Üsküp Gezi Rehberi	https://yoldaolmak.com/uskup-gezilecek-yerler.html
170607	2025-09-20T08:15:00	Çeşme Gezi Rehberi	https://yoldaolmak.com/cesme-gezilecek-yerler.html
185899	2025-09-19T08:18:50	Rodos Gezi Rehberi	https://yoldaolmak.com/rodos-gezi-rehberi.html
241154	2025-09-18T08:19:26	Feribot Seyahati Rehberi	https://yoldaolmak.com/feribot-seyahati.html
146066	2025-09-15T08:11:00	Kuzey Ege&#8217;nin Kalbi: Ayvalık Gezi Rehberi	https://yoldaolmak.com/ayvalik-gezi-rehberi.html
38493	2025-09-12T08:01:00	Singapur Gezi Rehberi	https://yoldaolmak.com/singapur-gezi-rehberi.html
12587	2025-09-10T08:46:53	Evliya Çelebi Seyahatnamesi	https://yoldaolmak.com/evliya-celebi-seyahatnamesi.html
178071	2025-09-09T09:16:37	Trabzon Nerede – Trabzon&#8217;a Nasıl Gidilir	https://yoldaolmak.com/trabzon-nerede-trabzona-nasil-gidilir.html
21539	2025-09-09T08:33:00	Ege Bölgesi Gezilecek Yerler	https://yoldaolmak.com/ege-bolgesi-gezilecek-yerler.html
35354	2025-09-08T08:57:00	En Güzel Antalya Tatil Yerleri	https://yoldaolmak.com/antalyanin-en-guzel-tatil-yerleri.html
51428	2025-09-08T08:00:14	Galata Gezilecek Yerler	https://yoldaolmak.com/galata-gezilecek-yerler.html
90670	2025-09-06T08:00:00	Roma Gezilecek Yerler	https://yoldaolmak.com/roma-gezilecek-yerler.html
52764	2025-09-05T09:00:00	Boğazda Ahenkli Bir Köy: Kuzguncuk	https://yoldaolmak.com/bogazda-ahenkli-bir-koy-kuzguncuk.html
3003	2025-09-04T08:53:00	Malezya Gezi Rehberi	https://yoldaolmak.com/malezya-gezi-rehberi.html
50375	2025-09-04T08:11:00	Budapeşte Gezi Rehberi	https://yoldaolmak.com/budapeste.html
110425	2025-09-03T08:14:00	En Güzel Mersin Plajları	https://yoldaolmak.com/en-guzel-mersin-plajlari.html
32218	2025-08-12T08:10:00	Kaş Gezi Rehberi: Türkiye&#8217;nin En Büyüleyici Akdeniz Kasabası	https://yoldaolmak.com/kas-gorulecek-yerler.html
16810	2025-08-11T08:12:00	Arabayla Ege Turu Gezilecek Yerler 🚗	https://yoldaolmak.com/arabayla-ege-turu.html
242390	2025-08-09T17:39:56	Bungalov Tatili: Doğayla İç İçe, Huzurlu Bir Kaçış	https://yoldaolmak.com/bungalov-tatili.html
53379	2025-08-09T08:01:00	Datça Gezi Rehberi	https://yoldaolmak.com/datca-gezilecek-yerler.html
36979	2025-08-08T08:33:00	Mersin Gezi Rehberi	https://yoldaolmak.com/mersin-gezilecek-yerler.html
160965	2025-08-05T08:15:00	İzmir Tatil Yerleri	https://yoldaolmak.com/izmir-tatil-yerleri.html
13208	2025-08-04T08:11:00	Bafa Gezilecek Yerler	https://yoldaolmak.com/bafa-golu.html
186066	2025-08-03T08:25:00	Meis Adası Gezi Rehberi	https://yoldaolmak.com/meis-adasi-gezi-rehberi.html
1009	2025-08-03T08:06:00	Doğu Java: Madura Adası	https://yoldaolmak.com/madura-adasi.html
200472	2025-08-02T08:30:00	Kekova Tekne Turları Hakkında Tüm Bilgiler	https://yoldaolmak.com/kekova-tekne-turlari.html
1506	2025-08-02T08:08:00	Asya&#8217;daki Amazon: Gunung Mulu Ulusal Parkı	https://yoldaolmak.com/mulu-ulusal-parki.html
55876	2025-08-01T08:13:00	Bulgaristan Gezi Rehberi	https://yoldaolmak.com/bulgaristan-gezi-rehberi.html
10078	2025-08-01T08:05:00	Sidney Gezi Rehberi	https://yoldaolmak.com/sidney.html
46732	2025-07-29T08:03:00	Kapadokya&#8217;nın İlginç Köşesi: Çavuşin Köyü	https://yoldaolmak.com/cavusin-koyu-kapadokya.html
19002	2025-07-28T08:01:00	Dünyanın En Küçük Aktif Volkanı: Taal Yanardağı	https://yoldaolmak.com/taal-volkani-tagatay-filipinler.html
199849	2025-07-27T21:14:00	Munzur Vadisi Milli Parkı	https://yoldaolmak.com/munzur-vadisi-milli-parki.html
13055	2025-07-27T18:05:47	Songkran Festivali: Asya&#8217;nın Eğlenceli Yılbaşı Kutlaması	https://yoldaolmak.com/songkran-festivali.html
46876	2025-07-27T08:55:00	Asya&#8217;da Görmeniz Gereken Daha Önce Adını Hiç Duymadığınız 10 Yer	https://yoldaolmak.com/asyada-gorulmesi-gereken-ilginc-yerler.html
154912	2025-07-22T08:45:00	Aspendos Antik Kenti: Aspendos Tiyatrosu	https://yoldaolmak.com/aspendos-antik-kenti.html
3104	2025-07-22T08:02:00	Çılgın Full Moon Party: Dolunay Partisi	https://yoldaolmak.com/full-moon-party-dolunay-partisi.html
110419	2025-07-20T08:28:00	Mersin En İyi Tatil Yerleri	https://yoldaolmak.com/mersin-tatil-yerleri.html
12988	2025-07-19T08:28:46	Avrupa&#8217;da Vizesiz Gidebileceğiniz 10 Ülke	https://yoldaolmak.com/vizesiz-avrupa-ulkeleri.html
11939	2025-07-15T08:32:00	Tayland’ın En Güzel 10 Adası	https://yoldaolmak.com/tayland-adalari.html
19252	2025-07-13T08:30:20	Türkiye&#8217;ye Yakın Vizesiz Gidilecek Ülkeler ve Şehirler	https://yoldaolmak.com/vizesiz-gidilecek-en-yakin-ulkeler-sehirler.html
17948	2025-07-10T08:21:00	Türkiye UNESCO Dünya Mirası Listesi	https://yoldaolmak.com/turkiye-unesco-miraslari.html
48314	2025-07-09T08:10:16	Kapadokya Gezi Rehberi	https://yoldaolmak.com/kapadokya-gezi-rehberi.html
41170	2025-07-09T08:05:53	Dünyanın Sonuna Yolculuk: “Kia Ora” Yeni Zelanda	https://yoldaolmak.com/dunyanin-sonuna-yolculuk-kia-ora-auckland-yeni-zelanda.html
9797	2025-07-09T08:00:16	Güçlü Bir Ruha Sahip Şehir: Lizbon	https://yoldaolmak.com/lizbon.html
37686	2025-07-08T08:12:40	Dünyada Eşine Az Rastlanır Bir Miras: Adamkayalar	https://yoldaolmak.com/adamkayalar-mersin.html
3133	2025-07-07T08:15:00	Egzotik Parti Adası: Koh Phangan	https://yoldaolmak.com/koh-phangan-adasi.html
27708	2025-07-06T19:29:00	Kıbrıs Gezilecek Yerler	https://yoldaolmak.com/kibris-gezilecek-yerler.html
50895	2025-07-06T08:31:00	UNESCO Listesindeki Başkent: Ani, Kars	https://yoldaolmak.com/ani-antik-kenti-kars.html
146467	2025-07-06T08:12:00	Bir Yeniçeri Köyü: Yeniçarohori, Ayvalık	https://yoldaolmak.com/yenicarohori-kucukkoy.html
162034	2025-07-05T09:00:13	Granada Gezilecek Yerler	https://yoldaolmak.com/granada-gezilecek-yerler.html
186771	2025-07-05T08:13:00	Avustralya Gezilecek Yerler	https://yoldaolmak.com/avustralya-gezilecek-yerler.html
50823	2025-07-03T09:00:54	Güneş&#8217;in En Güzel Battığı Yerlerden: Knidos, Datça	https://yoldaolmak.com/knidos-antik-kenti-datca.html
154930	2025-07-03T08:22:00	Kaputaş Plajı, Antalya	https://yoldaolmak.com/kaputas-plaji.html
53885	2025-07-02T08:52:41	Dünyanın En Eski Kumulları: Benzersiz Namib Çölü	https://yoldaolmak.com/namib-colu.html
167534	2025-06-28T09:00:01	Anadolu Uygarlığına Bir Yolculuk: Kaman Kalehöyük, Kırşehir	https://yoldaolmak.com/kaman-kalehoyuk.html
52306	2025-06-24T11:14:24	Çölün Yuttuğu Hayalet Kasaba: Kolmanskop, Namibya	https://yoldaolmak.com/colun-yuttugu-hayalet-kasaba-kolmanskop-namibya.html
34713	2025-06-20T15:36:42	Ras Muhammed Milli Parkı, Şarm El Şeyh	https://yoldaolmak.com/ras-muhammed-milli-parki-sarm-el-seyh.html
39500	2025-06-20T09:00:03	Kafkas Dağları Arasında Enfes Bir Coğrafya: Dombay	https://yoldaolmak.com/kafkas-daglari-arasinda-enfes-bir-cografya-dombay.html
52233	2025-06-20T00:22:05	Namibya&#8217;nın Ünlü Safari Parkı: Etosha National Park, Namibya	https://yoldaolmak.com/etosha-national-park-namibya.html
152036	2025-06-19T09:00:54	Kaderine Terk Edilmiş Karya Şehri: Thera Antik Kenti	https://yoldaolmak.com/thera-antik-kenti-mugla.html
52283	2025-06-17T17:04:45	Görkemli Kum Tepeleri: Sossusvlei, Namibya	https://yoldaolmak.com/sossusvlei-namibya.html
408	2025-06-17T08:13:56	Bir Çöl Kasabası: Coober Pedy	https://yoldaolmak.com/bir-col-kasabasi-coober-pedy.html
27232	2025-06-10T16:28:18	Kızıldeniz Dalış Turu, Hurghada	https://yoldaolmak.com/kizildeniz-dalis-turu.html
28904	2025-06-08T21:23:53	Mısır Güvenli Mi?	https://yoldaolmak.com/misir-guvenli-mi.html
35274	2025-06-06T23:08:37	İranlıların Tatil Yeri: Kiş Adası, İran	https://yoldaolmak.com/kis-adasi-iran.html
26181	2025-06-05T16:09:23	Tarihteki İlk ve Tek Kadın Firavun: Hatşepsut	https://yoldaolmak.com/hatsepsut-deir-el-bahari-teb.html
201972	2025-06-02T09:19:59	Seyahat Sağlık Sigortası	https://yoldaolmak.com/yurtdisi-seyahat-saglik-sigortasi.html
170610	2025-06-02T08:40:00	Selimiye Gezilecek Yerler	https://yoldaolmak.com/selimiye.html
40570	2025-06-01T09:00:21	Bir Film Atmosferi: Meersburg Ortaçağ Pazarı	https://yoldaolmak.com/meersburg-ortacag-pazari.html
26145	2025-05-31T19:25:55	Dev Memnon Heykelleri: Colossi Of Memnon	https://yoldaolmak.com/dev-memnon-heykelleri-colossi-memnon.html
36227	2025-05-30T09:00:48	Kafkasya&#8217;nın Yeni Tatil Noktası: Arhız, Rusya	https://yoldaolmak.com/kafkasyanin-yeni-tatil-noktasi-arhiz-rusya.html
184561	2025-05-30T08:10:00	İtalya Gezilecek Yerler	https://yoldaolmak.com/italya-gezilecek-yerler.html
198448	2025-05-28T08:11:00	Elazığ Gezi Rehberi	https://yoldaolmak.com/elazig-gezi-rehberi.html
7398	2025-05-28T07:56:23	Tayland Kültürü Hakkında Bilgiler	https://yoldaolmak.com/tayland-kulturu-hakkinda-bilgiler.html
39249	2025-05-27T09:00:41	Pastoral Vadi Organik Tarım ve Ekolojik Yaşam Çiftliği, Fethiye	https://yoldaolmak.com/pastoral-vadi-fethiye.html
10288	2025-05-27T08:28:09	İtalya Gezi Rehberi	https://yoldaolmak.com/italya-gezi-rehberi.html
3319	2025-05-26T08:12:00	Phuket Gezi Rehberi	https://yoldaolmak.com/phuket-gezi-rehberi.html
192651	2025-05-25T08:11:00	Avşa Adası Gezilecek Yerler	https://yoldaolmak.com/avsa-adasi-gezilecek-yerler.html
158141	2025-05-25T08:11:00	Türkiye&#8217;nin En Güzel Milli Parkları	https://yoldaolmak.com/turkiyenin-en-guzel-milli-parklari.html
55096	2025-05-24T09:00:17	Sakız Adası Gezi Rehberi	https://yoldaolmak.com/sakiz-adasi-gezi-rehberi.html
54523	2025-05-24T08:36:36	Tahran Gezi Rehberi	https://yoldaolmak.com/tahran-gezilecek-yerler.html
26781	2025-05-24T08:34:00	Şarm El Şeyh Gezi Rehberi	https://yoldaolmak.com/turizm-ve-tatil-sehri-sarm-el-seyh-misir.html
16219	2025-05-23T08:08:19	Ünlü Pers Şehri: Persepolis, Şiraz	https://yoldaolmak.com/persepolis-siraz.html
10875	2025-05-22T08:21:00	Ankara&#8217;nın En İyi Müzeleri	https://yoldaolmak.com/ankara-muzeleri.html
16255	2025-05-22T08:07:00	Aşkın ve Şiirin Şehri: Şiraz	https://yoldaolmak.com/askin-ve-siirin-sehri-siraz.html
54283	2025-05-21T09:00:25	Karşıda Nefis Bir Ada: Sakız Adası	https://yoldaolmak.com/sakiz-adasi.html
9831	2025-05-21T08:40:01	Stockholm Gezi Rehberi	https://yoldaolmak.com/stockholm-gezi-rehberi.html
39891	2025-05-21T08:28:19	Puglia Gezilecek Yerler	https://yoldaolmak.com/puglia-gezi-rehberi.html
178468	2025-05-21T08:00:13	Kekova&#8217;da Saklı Bir Köy: Üçağız, Demre	https://yoldaolmak.com/ucagiz.html
204943	2025-05-20T08:11:00	Kelebekler Vadisi	https://yoldaolmak.com/kelebekler-vadisi.html
39881	2025-05-19T09:00:00	İtalya&#8217;nın Az Bilinen Köşesi: Itria Vadisi	https://yoldaolmak.com/itria-vadisi-puglia.html
44369	2025-05-19T08:18:00	Belgrad Gezi Rehberi	https://yoldaolmak.com/belgrad-gezi-rehberi.html
192302	2025-05-19T08:11:12	Manavgat Gezi Rehberi	https://yoldaolmak.com/manavgat-gezilecek-yerler.html
36897	2025-05-19T08:00:49	Cennet-Cehennem Çökükleri	https://yoldaolmak.com/cennet-cehennem-mersin.html
154276	2025-05-16T08:27:24	Sirkeci Gezilecek Yerler	https://yoldaolmak.com/sirkeci-gezilecek-yerler.html
9381	2025-05-16T08:22:42	Dünyanın En Ünlü Balmumu Müzesi: Madame Tussauds, Londra	https://yoldaolmak.com/madame-tussauds-londra.html
198665	2025-05-16T08:01:00	Phaselis Antik Kenti: Phaselis Koyu	https://yoldaolmak.com/phaselis.html
11722	2025-05-15T23:16:03	Bergama Müzesi, İzmir	https://yoldaolmak.com/bergama-muzesi.html
33061	2025-05-15T17:54:01	Vietnam Turu Yapmak İçin 10 Neden	https://yoldaolmak.com/vietnama-gitmek-icin-10-neden.html
54763	2025-05-15T15:09:42	Katar Gezi Rehberi	https://yoldaolmak.com/katar-gezi-rehberi.html
11291	2025-05-15T09:00:25	Bergama Antik Kenti	https://yoldaolmak.com/bergama-antik-kenti.html
16621	2025-05-14T08:39:00	En İyi Kıbrıs Otelleri	https://yoldaolmak.com/en-iyi-kibris-otelleri.html
192988	2025-05-14T08:00:00	Ulucanlar Cezaevi Müzesi, Ankara	https://yoldaolmak.com/ulucanlar-cezaevi.html
55707	2025-05-13T15:32:00	Kırgızların Geleneksel Avcılığı: Salburun	https://yoldaolmak.com/salburun-kirgizistan.html
52700	2025-05-13T09:00:12	Batı Trakya&#8217;da Bir Şehir: İskeçe, Yunanistan	https://yoldaolmak.com/iskece-yunanistan.html
36603	2025-05-13T08:46:25	Türkiye&#8217;nin En İyi 15 Butik Oteli	https://yoldaolmak.com/en-guzel-butik-oteller.html
13890	2025-05-13T08:45:00	Anadolu Medeniyetleri Müzesi	https://yoldaolmak.com/anadolu-medeniyetleri-muzesi.html
189870	2025-05-11T08:30:55	Noel Baba Kimdir: Aziz Nikolaos Nasıl Noel Baba Oldu?	https://yoldaolmak.com/noel-baba-kimdir.html
32045	2025-05-10T09:00:19	Fresco Cave Suites, Ürgüp	https://yoldaolmak.com/fresco-cave-suites-urgup-kapadokya.html
185909	2025-05-10T08:22:00	Kaş-Fethiye Arası Gezilecek Yerler	https://yoldaolmak.com/kas-fethiye-arasi-gezilecek-yerler.html
42770	2025-05-10T08:15:00	Amalfi Gezi Rehberi	https://yoldaolmak.com/amalfi-gezilecek-yerler.html
161615	2025-05-09T08:45:40	Göreme Milli Parkı, Kapadokya	https://yoldaolmak.com/goreme-milli-parki-kapadokya.html
180876	2025-05-09T08:08:00	İsveç Gezilecek Yerler	https://yoldaolmak.com/isvec-gezi-rehberi.html
155103	2025-05-08T09:00:32	Fethiye Amintas Kaya Mezarları	https://yoldaolmak.com/fethiye-amintas-kaya-mezarlari.html
52315	2025-05-08T09:00:10	Sakız Adası Gezilecek Yerler	https://yoldaolmak.com/sakiz-gezilecek-yerler.html
